message;sha
Revert "TAJO-463: Throw PlanningException when Creating table with Partition exception COLUMN. (DaeMyung Kang via hyunsik)"--This reverts commit b574cf8c46bbcdf2601fc20ef149d08b0a88742f.;5c243f1a3b01a0e91884d9b894a338c371c5e9a4
TAJO-463: Throw PlanningException when Creating table with Partition exception COLUMN. (DaeMyung Kang via hyunsik);b574cf8c46bbcdf2601fc20ef149d08b0a88742f
TAJO-381: Implement find_in_set function. (Jae Young Lee via hyunsik);4c7579009c137570ecc412d1365ace77fbbd4b87
TAJO-452: Timstamp literal with fractional seconds results in java.lang.ArrayIndexOutOfBoundsException. (Keuntae Park via hyunsik).;319a37725feb5fe4fa04280da4fd11fd24406960
TAJO-454: pass invalid argument to DateTime constructor in LogicalPlanner. (DaeMyung Kang via hyunsik);7306ba324a744631a2c9205a8ca260b9fe32fed5
TAJO-432: Add shuffle phase for column-partitioned table store. (Min Zhou via jihoon);eac2507afaecea32ce406a32d7632016ebbc593d
TAJO-439: Time literal support. (DaeMyung Kang via jihoon);3a5a617c6bb1dd10d026ab0735f9031623a66d30
TAJO-451: Update documentation and version constant for Tajo 0.8. (hyunsik);9d86ff7bce7472bbdb6b35bc3d1ace887dd9d2c2
TAJO-448: Timestamp should be based on unixtime. (hyunsik);fce88829d58885197f67c477699b57c632e7246d
TAJO-135: Bump up hadoop to 2.2.0. (jihoon);ecc749e811b9f978c9d9bb2cd9bfee6f795653df
TAJO-450: Incorrect inet4datum comparison. (jinho);074a34157b6a9084ca762627cf1b370818fcda90
TAJO-437: Timestamp literal support. (hyunsik);4319ded3aa974dfca35fd2630b97b8f2601507c4
TAJO-182: Correct NULL value handling of primitive operators. (hyunsik);e8c5c27717e134264a93a0430521a07c45079215
TAJO-431: HCatalogStore can't write any data using INSERT OVERWRITE clause. (jaehwa);302824a390fcbe0f51914dd0347c5a17da22d298
TAJO-382: Implement encode/decode functions. (Seungun Choe via jihoon);bd2b891994c8e3c52d956ffb3879b1ec60d70eec
TAJO-436: Implement ceiling(FLOAT8) function. (DaeMyung Kang via hyunsik);9409a051435b56865a94b92aecad8ae4834dfff6
TAJO-442: Cast operator with nested functions causes NPE. (hyunsik);450fbcb93c02c74fd8889751bdec5ce155e3e294
TAJO-435: Improve intermediate file. (jinho);f08724f9c8bb80d93db0d5517fe6351a9a4d6e63
TAJO-338 - Add Query Optimization Part for Column-Partitioned Tables. (hyunsik);f58f6ee827139c01253902f0b1076b47fde9d5e6
TAJO-426: HCatalogStore created partitions automatically. (jaehwa);4dbecf90161465b2818093fe8544b35f86b888aa
TAJO-424: Make serializer/deserializer configurable in CSVFile. (jinho);2c53ccc11ffc94bbbddfaa4fe1831b12405ff229
TAJO-419: Add missing visitor methods of AlgebraVisitor and BaseAlgebraVisitor. (hyunsik);775cfaaad49fee4e79b7cd582b381740461fa6b9
TAJO-418: sort operator after Inline views consisting of unions can cause an incorrect distributed plan. (hyunsik);d930a90d50ce9b41050486ace11c96d0847b80b0
TAJO-421: Improve split for compression file. (jinho);14160face45894a73f742f528e87b5f8ec2e10b9
TAJO-327: Add testcase to verify TAJO-16. (jaehwa);1d2bd0d97949c6a0475c4e180505aeaa12188b51
TAJO-417: TestSQLExpression.testCastFromTable causes unit test failure. (hyunsik);b4a71dc74171416f4274e524d07a685b54d9067d
TAJO-415: Some complex queries causes NPE and unlimited recursions. (hyunsik);a90895a74a13c654a8d12345bbbdd8d3b08c604c
TAJO-333: Add metric system to Tajo. (hyoungjunkim via jihoon);62c49c05f522158d75d818df49100a0b1fd354bb
TAJO-413: Implement pi function. (DaeMyung Kang via jihoon);1d0d458bf28af7cfb5a4134c41d0fb0e874f78f9
TAJO-414: Fix bug of bit operations in decode() method of DateDatum class. (Keuntae Park via jihoon);fe7515d66a2ec3ef4fe0e33cb050e93f7e93631f
TAJO-407: PostgreSQL-style cast should have higher operator priority. (hyunsik);3c302d9e290f5cacaa00d24750fae72d3d35c3e0
TAJO-411: Fix Bug: createFromInt8's DATE type should be TIMESTAMP. (DaeMyung Kang via jihoon);1b3cfb100c981223ebf82b9021b51eeb7d1cd909
TAJO-61: Implement Time Datum Type. (DaeMyung Kang via hyunsik);2ff0eeaccb1ff37c5f54d1ac8aafedda7bdf6855
TAJO-390: Queries on history are expired ealier than a given expiry time. (hyoungjunkim via hyunsik);0ee6b2432efbc809e60df6de073f839d3a2b9894
TAJO-410: A query with a combination of general and distinct aggregation functions fails. (hyunsik);df56fca7c0d47188497444052eeea9b0abc9cbf6
TAJO-60: Implement Date Datum Type. (hyunsik);2a3173757cd74c91f625853e888314be33b36f56
TAJO-405: Improve HCatalogStore to support partitioned table. (jaehwa);93bae895f539ca1c787150210ce78b2d3233d366
TAJO-400: Implement pow(float8, float8) function. (DaeMyung Kang via jaehwa);01c25d28cc5c541d641d4fa71553d400439907c7
TAJO-384: to_bin(). (Jae Young Lee via jaehwa);551faa514cfb58b3174829c0f318a760b8d0d69d
TAJO-336: Separate catalog stores into separate modules. (jaehwa);60f7df201d560e2693c29cd75674f2bccccf9092
TAJO-404: Tajo does not recognize boolean literal. (hyunsik);34a296f9549e988acf03313bb0abcab9d4495e64
TAJO-62: Implement Timestamp Datum type. (hyunsik);ea5aa8f471c6a0cd8d97bb00eaaceabcdc50b666
TAJO-307: Implement chr(int) function. (DaeMyung Kang via hyunsik);ad6ff6ede187bea29e64c1745fad4d90f7049433
TAJO-329: Implement physical operator to store in column-partitioned table. (jaehwa);22a6136d33da65f86319aead0a60c34140b11172
TAJO-365: Implement degrees/radians function. (DaeMyung Kang via hyunsik);0ddf6ef4aa2991d88e4a26346e6678da5c14267b
TAJO-368: Implement quote_ident function. (Seungun Choe via hyunsik);25944a91290781774b7566fe64439d33cac1b18a
TAJO-392: Implement cbrt function. (DaeMyung Kang via hyunsik);6df36b02d495c9a591297cc85f7df27a58040cf3
TAJO-394: Implement abs function. (DaeMyung Kang via hyunsik);2c7f552a54080d98545bc4b3cb162b48eadcf287
TAJO-395: Implement exp function. (DaeMyung Kang via hyunsik);c4d331352daf6b9a742b23696ddfa235761e9c68
TAJO-396: Implement sqrt function. (DaeMyung Kang via hyunsik);595675cc7190de87f60bcf3193c42ef1190c2837
TAJO-397: Implement sign function. (DaeMyung Kang via hyunsik);3a05bbf3d0cbe83e5302dcbeeeb53b63940917b2
TAJO-344: Tajo cannot recognize negative numeric expressions. (hyunsik);17d9cd7357d9e4e079a61acbaa755206c5f019db
TAJO-393: Unit tests must use test-data directory. (hyunsik);8ce2a940212ef069a443b767102500e5252b7566
Update documentation by TAJO-317. (Keuntae Park, jihoon, and hyunsik);7e47f6b017717fcc8917b6881fc90c4ade37a8b2
TAJO-343: Implement locate function. (KyoungBok Lee via hyunsik);3c2a6343fe9056c9e520442b744ba924704fc3dd
TAJO-391: Change the default type of real values from FLOAT4 to FLOAT8 when parsing the user queries. (DaeMyung Kang via jihoon);b444061e2739f71de6d5ce39c2b8bc60b2fa0d9b
TAJO-388: limit clause does not work properly. (hyunsik);469c5a2437ded40da5675d2e87c7115583cd1b67
TAJO-304: drop table command should not remove data files in default. (hyunsik);c033d85cf065b9030e97e0b4c3596adacbbc255c
TAJO-389: The LazyTuple does not work when number format exception occurs in text deserializer. (jinho);19b6abc3ec9c6b9f276194937e00ba3fe976e012
TAJO-387: Query is hanging when errors occurs in Query or SubQuery class. (Added a missed changelog);988fff90c9084762666635d558a203c6903f3dc1
TAJO-387: Query is hanging when errors occurs in Query or SubQuery class. (hyunsik);da8cd2984317b61273ccd0d415401873c4eb4d7c
TAJO-268: Temporal files should be removed after query is finished. (jinho)-TAJO-292: Too many intermediate partition files. (jinho);c18a3f862cf764205abc8d8e491dbc6719a7c730
TAJO-316: Improve GreedyHeuristicJoinOrderAlgorithm to deal with non-commutative joins. (hyunsik);39fe4d765f84af5094387d3a93399c1a0a9fef10
TAJO-364: Implement mod/div function. (DaeMyung Kang via jaehwa);45de54bcd915f125c6bf39f3fb62d5b4f0d0780f
TAJO-361: Implement rpad function. (Seungun Choe via jaehwa);96665ff0b184a3c33384e40edec13003686df0cd
TAJO-359: Implement lpad function. (Seungun Choe via jaehwa);d9e458fa011120d914b50212b094f0c5f9401fb0
TAJO-375: TajoClient can't get result data when different os user. (hyoungjunkim via hyunsik);ab2da738b962e0e4b6687d24d74b28d573634984
TAJO-306: Implement ascii(string) function. (SeongHwa Ahn via jaehwa);798d3010b1b28e47e281cb5f729e3a6713eeea33
TAJO-371: Increase the default value of worker memory. (jihoon);42999010e01040391b32474dcd54ffbff5741e6c
TAJO-354: Fix invalid type to valid type for udfs(bit_length/char_length) (DaeMyung Kang via hyunsik);e74f254bd87511f6a14044b728fbf7048985810a
TAJO-366: Implement trigonometric functions. (Jae Young Lee via jihoon);abc08308f7fe54619c56c6dbba5e4c0e7b669aa8
TAJO-358: Implement initcap(string) function. (Seungun Choe via hyunsik);3e2a2636e902137740d5e6e3510af565d8d33106
TAJO-284: Add table partitioning entry to Catalog. (jaehwa);0b0de13b2444f9e75ad3e1f42cba51ddb1f86dc2
TAJO-355: Implement repeat(text,int) function. (DaeMyung Kang via jaehwa);29a0aa01c5e68422841170b86537eab169eabf26
TAJO-339: Implement sin( x ) - returns the sine of x (x is in radians). (Jae Young Lee via jaehwa);2659cda4a88d074a7664babc39ac6ec1719778eb
TAJO-348: Implement octet_length(text). (DaeMyung Kang via jaehwa);19c7585cc775764860341fcc9404ee92d80d3b20
TAJO-357: Fix invalid filename TestMethFunction to TestMathFUnction. (DaeMyung Kang via hyunsik);b3d754e288c0a6004d8e2ade94ad51e690ac0041
TAJO-352: Implement right/left(text, size) function. (DaeMyung Kang via hyunsik);43ec04aaa34ffe5c5da2cfd05ff919ffac44044b
TAJO-317: Improve TajoResourceManager to support more elaborate resource management. (Keuntae Park via jihoon);528c914f9a133bef79df07017cfa424c9fab4412
TAJO-346: Implement hex function. (DaeMyung Kang via hyunsik);778c01f8f71ea6dd4573e83c5b62ccefcd39b337
TAJO-349: Implement md5(text). (DaeMyung Kang via hyunsik);c26831669afd25b4e34fe7fad457eab4e98bcb00
TAJO-351: TAJO-351: Implement reverse(text). (DaeMyung Kang via hyunsik);14ec0ec133fb0b93ecf9f71628daf80399b0f6a8
TAJO-342: Implement strpos(string, substring) function. (hyoungjunkim via hyunsik);e29b062d69315d24d75d121b53987e24e0451071
TAJO-350: Implement round, floor, ceil. (hyoungjunkim via hyunsik);3233d3824b8b8c572afe096f41511794d2633e9c
TAJO-347: Fix bug when to call function with insensitive function name. (DaeMyung Kang via hyunsik);dc56c8e714c1c930e6b572bfc9b5aed302075d12
TAJO-207: Implement bit_length(string) function. (fixed a missing log in CHANGES.txt);02fd6cb9ab7664760d5549c8e59def0759118e6c
TAJO-345: MergeScanner should support projectable storages. (jihoon);1191003ef2f20acdfa84490eb314a0e8c5d510de
TAJO-207: Implement bit_length(string) function. (DaeMyung Kang via jihoon);a26c588e31c54e791cbb45f7d5bf1336d0c72da6
TAJO-341: Implement substr function. (hyoungjunkim via hyunsik);f9a6e9ca3dbfc7c518ad6f0d3b1c9fe3196b654e
TAJO-290: TajoDataType.Type.NULL should be NULL_TYPE. (DaeMyung Kang via jinho);2e27a0232ac1bf48fe277a22a818d282866216c7
TAJO-279: Improving the query_executor page of web UI. (Wan Heo via jihoon);87437f1718e5e55ca4eb4517fcb3a00707cbc5a9
TAJO-308: Implement length(string) function. (hyoungjunkim via hyunsik);1f80cd24b7d1005aa6874143c827bde72d55da84
TAJO-332: Invalid row count of CSVScanner. (jinho);b8435e7c2dd9999023cca6040b33427dd886c2ae
TAJO-314: Make TaskScheduler be pluggable. (fixed missing changes in the configuration);67e0d94c4828b014b3b83a6713b172b482b63a6a
TAJO-314: Make TaskScheduler be pluggable. (jihoon);92674542d03e0c3109950cd3da5f16d1c786425d
TAJO-325: QueryState.NEW and QueryState.INIT should be combined into one state. (Min Zhou via hyunsik);6565d2bf1e0f9170a318e06553b4c5c70ee0b642
Removed obsolete files and improved source code page.;83d40290423c2c6d6fa23c0077c8ad7c079b5d60
Fixed wrong links and improved downloads page.;303603379c86cf4208fb90781477981bf4d04efb
TAJO-326: In ExecutionBlock, isRoot() and isLeafBlock() return invalid values. (jihoon);e5b881081230da251ba86e122a3bac02a91c5639
TAJO-296: Late registration of Tajo workers. (hyoungjunkim via hyunsik);b37453d004f0be10864e1d1188f28a768f5141ca
TAJO-322: Documentation by version. (fixed missing licenses);0c1262aed97bd1d3644a695da71ab18c13ebcff0
TAJO-322: Documentation by version. (hyunsik);74a786480b0783939ff3453eb0d6a446a93dbc93
TAJO-321: Invalid split file of compressed text file. (jinho);ffcf1e9097d2ef1104f868b893f4936a9e53f8c2
TAJO-320: Visualize Tajo statemachine. (Min Zhou via hyunsik);a7399577a72319982fd4ad197b792f1db88bf472
TAJO-200: RCFile compatible to apache hive. (jinho);effa7df63627940fe7b7e6c89591795a95cdbb3e
TAJO-319: Update homepage and bump tajo version to 0.8. (hyunsik);73911a159c66db379c258a408c08765c897ed34d
TAJO-313: Support deprecated variables in CatalogConstants. (jaehwa);4b12aaafcee7b8849fb9147f0b5b56f0c67d2220
TAJO-176: Implement Tajo JDBC Driver. (Keuntae Park via jihoon);342fd47ffd2a30f4941256ac4a5bc95707004599
TAJO-310: Make the DataLocation class as a separate class and move it to the tajo-core-storage package. (jihoon);6e2db3baf86d68ec844a523b5fb2de5d800494c5
TAJO-311: Improve Hive dependency. (jaehwa);67a4d108321765401bbee04b489262d92bde8ad3
TAJO-309: Remove unused fields in FileFragment. (jihoon);67ae6bc7ac6c99ed0ee203698254d44e1c1cda93
TAJO-16: Enable Tajo catalog to access Hive metastore. (jaehwa);943899360a29fdab2ee1aefa7f1708f5666939c6
TAJO-297: Rename JDBC variables in CatalogConstants to be more generic. (jaehwa);f4672e10466b361f020c26bad752ca12dc0adf3a
TAJO-295: ConcurrentModificationException in TaskScheduler. (jinho);5dbdd26d76786b22aea38bebfa0b5ad460eebddd
TAJO-285: Add CREATE TABLE... BY PARTITION statement to parser. (Fixed file encoding problem);2186e63b13ecde617cf79e408a13740755637822
TAJO-285: Add CREATE TABLE... BY PARTITION statement to parser. (hyunsik);06b1e0e70c52c17b68a2cd726985149d5430bd78
TAJO-294: Removing dead workers from the live worker list. (Keuntae Park via jihoon);8e6fec0fcb95c24017ee082df44853a222eb9db5
TAJO-293: querymasters directory not found in single node setup. (hyunsik);99959420a2362cc7c42a9c8ed7ea294541793bec
TAJO-287: Improve Fragment to be more generic. (hyunsik);3c22d3eba437e9130ee74de8f935c7fc330b1217
TAJO-274: Maintaining connectivity to Tajo master regardless of the restart of the Tajo master. (Keuntae Park via hyunsik);2f09450442bdbdda2a34f9ad4ec66643344a17fd
TAJO-288: Correct NOTICE file and LICENSE.txt. (hyunsik);3ed1514f389aec22447da3a37fbd386af6a83c79
TAJO-281: 'mvn package -Pdist' generates duplicate Tajo jar files. (hyunsik);c0d71913e746f2c930425837a6516cf49d8f80f7
TAJO-287: Refactor TableDesc, TableMeta, and Fragment. (hyunsik);7dc8de2833aec5b2d7b9b25d238775e74165243d
TAJO-275: Separating QueryMaster and TaskRunner roles in worker. (Keuntae Park via jihoon);5470bcea1ae3ec4c627f7f6fc7efa2c1c19e06cd
TAJO-278: Add ASF License 2.0 header to *.jsp and web.xml files. (hyunsik);fdf09796cfe2ee7f8a8d322d7900a1e23443b5d2
Updated the instruction and information of building.txt and readme file.;b8ab8c9fd0f2b77e82c8e3ae0b3d366b8075152d
TAJO-277: Infinite loop occurs when a table is empty. (jinho);e470c45a895785d7737e5322bfd23a5a6ccf27a1
TAJO-270: Boolean datum compatible to apache hive. (jinho);85cff2e7101e6e059285a80268ba2d8aaaca00ec
TAJO-273: NotEval incurs NPE with boolean column. (hyunsik);b55918bd1dc32a1b034bb67a47114a92bce24b48
Updated site's links and controbutors' organization.;5855b00c262ea291b9a0298e0d5b89074599a50f
TAJO-272: boolean test does not work correctly. (hyunsik);77eff67b043d30813314b13b255b647cec6f529a
TAJO-271: Add MIT license to NOTICE.txt and LICENSE.txt for jquery and jsPlumb. (hyunsik);3f267a2fb54b7a99eff6a12537c7f51c65d051c4
TAJO-265: Update installation guide and other documentation for 0.2 release. (hyunsik);df62402ff767d23eef6dd986e14c65b03bd7630e
TAJO-267: Implement equals() and deepEquals() functions at LogicalNode. (jihoon);668fed59561114c96e8120f6705fc5dc5e2a3ffe
TAJO-261: Rearrange default port numbers and config names. (hyunsik);d51283284688dfa25550cfe773dfc52391d6b266
TAJO-264: Remove hard-coded 'standby' mode. (jinho);93b435d28f361a1f6e54b331a6744ed81cde20f6
TAJO-262: Integration test hang on jenkins. (jinho);f5a18dbfcf420950ff715d7cc25834036cc7d578
TAJO-260: Add between predicate. (hyunsik);95fa2667b12711c7438372ae6e0bcf74f0733f14
TAJO-208: Implement char_length(string) function. (hyunsik);4074a469244685182158d629e842248a40948689
TAJO-236: Implement LogicalPlanVerifier to check if a logical plan is valid. (hyunsik);0cf9d4e2024fe513fce8dac14f0e9eff2135482e
TAJO-254: Refactor package names and class names to have proper names. (hyunsik);1325c42e53a3ef23ec07b9ece71714504aea26b6
TAJO-257: Unit tests occassionally fail. (hyunsik);fd60ec395b951764caaed8a8ebe5bf5bef1eb96f
TAJO-257: Unit tests occassionally fail. (hyunsik);202aa29b7e0dc807f2637cf4b6be71a277c0909f
TAJO-255: Cleanup exceptions of engine. (hyunsik);3f45f0cdde6c15a820a19f5b5c5a52f7f0322ed8
TAJO-253: Clean up tajo-default.xml in test resource. (hyunsik);660606beb6865e0a74cfb67cda076db107576a22
TAJO-252: Add DISCLAIMER file. (hyunsik);98b4d315090ff76f8529bb429817829bc1955b13
TAJO-251: Rename the legacy name *.tql to *.sql. (hyunsik);0bea1fddd930ebf50e132f155e0e41d58199ee58
TAJO-169: the default TAJO_WORKER_STANDBY_MODE in tajo-env.sh is wrong. (hyunsik);683aaf4f0575f0c749e2fe24c07268e4ae4f3bf9
TAJO-231: In StorageManger v2, TestCSVCompression incurs unexpected end of stream occasionally. (hyunsik);9ebe23536dad2877009c92f80d9de6b60f35d6a2
TAJO-250: QueryMaster must send the query finish heartbeat. (fixed a missing part);447b50e99e7fdf7079846e6b13e38fad6e0b2c1d
TAJO-250: QueryMaster must send the query finish heartbeat. (hyunsik);4dcaffd3c8d1da081c3943af0e89d225f38832f5
TAJO-245: org.apache.tajo.algebra.FunctionExpr cannot be cast to org.apache.tajo.algebra.ColumnReferenceExpr. (hyunsik);2bbc3064c34ed59e990bd55584b980b83effc56f
TAJO-243: The 'tajo_dump' does not include options of table. (jinho);56a8e240471223e46b96f715bfcdd51305ad97f2
TAJO-244: assignToNonLeafTasks causes NPE occurs occasionally . (hyunsik);b23c2b5fef3a385d19ebb23e60f3ce80f3589707
TAJO-242: Enable omitted broadcast join feature after TAJO-184. (hyunsik);d01e47d3feaa7581024d2ac01760e52f1df9fab1
TAJO-99: Design the interface of join enumeration algorithm. (hyunsik);517355dc50fec4244bc5a9d5f7fc246cfc6f31a9
TAJO-239: Improving web UI. (Keuntae Park via hyunsik);85b839403fc5b3ccde944b650b23d2977321b852
TAJO-240: Reformat HiveConverter source code to match adopted conventions (jaehwa);5a257e2d4cd9ec2e10d47ca09041000012540be5
TAJO-241: Does not reconnect the meta store. (jinho);69a38eb3b2e8b6d09616bb6ff90ca9fb532c66d2
TAJO-232: Rename join operators and add other join operators to PhysicalPlanner. (hyunsik);d7645252fb6bc3152d9774c6a655b8c083ff21b6
TAJO-179: Support MySQL CatalogStore. (removed useless code);1023c8269540f2a3ceedd5942fef896db68217b1
TAJO-179: Support MySQL CatalogStore. (jinho);c0c6d47f3d0694458dfabf3d113b8fa941680622
TAJO-147: Implement trim(text), ltrim(text), and rtrim(text) function. (hyunsik);14ed2ea2383d58682958019d11f5ca4bc2e6f7fe
TAJO-148: Implement UPPER(text), LOWER(text) function. (hyunsik);b132b6b69382ac2fce70cc5e62ffaeea59a5c1f8
TAJO-226: Can't use group by column alias. (hyunsik);e7f975710f1abff8fd3ebf10322e6fcafac18e0e
TAJO-229: Implement JoinGraph to represent a graph of relation joins. (hyunsik);8b872bc17f9c7dfffdfd44d4c5717e37113ec804
TAJO-220: Implement catalog dump feature. (hyunsik);b9baf526f59bf668ddd9a80e53afd8360a10a6e8
TAJO-223: Maximize disk read bandwidth utilization of StorageManagerV2 by moving Tuple creation role to next() (Keuntae Park via hyunsik);4449d9c48e9d0cdca7fa4a523fe4f9f389404f87
TAJO-199: All relations in catalog must have data volume size. (hyunsik);3f61b973366f9b8a5a85469379b71f4dfb3ff7d6
TAJO-224: Rearrange DataType enumeration and Refactor type systems. (hyunsik);4bf5c0c3d51c2d12d57903ea7dc47cdfe4870290
TAJO-216: Improve FilterPushDownRule and Implement physical operators for outer join. (camelia_c via hyunsik);3e6d684a9f1c7592c99d359c376956fcc9e917ba
TAJO-211: Implement regexp_replace function. (hyunsik);406337d9d15e5f818d481060e1efd73c958fe26f
TAJO-212: Implement type cast expresion. (hyunsik);135b27a6ae481faeb0953fbe53baf81fd54a4628
TAJO-214: System should inquire finished query history after execution in web. (SeongHwa Ahn via hyunsik);bc19cc2f805b447412cf92f3dc7a3e81333d7c18
TAJO-145: count(distinct column) should be supported. (hyunsik);733192f3bfac8686055f219d4a5bad71d7948d30
TAJO-210: Implement String concatenation operator. (hyunsik);f4600ddfad489b16c6b584997be6edf7cb01216d
TAJO-213: NULL characters in meta of csv table should be supported. (jinho);3d30e25321d304e15c304e2822593aa3d285712d
TAJO-203: Field delimiter does not work correctly. (jinho);33f697683e7bda41ea83709184ec153a7628a36a
TAJO-205: Repartitioner occasionally chooses a partition number as one. (hyunsik);9ca97922386ef2954016efd54e94fd81c2f31f91
TAJO-197: Implement Enforcer that forces physical planner to choose specified algorithms. (hyunsik);17287ef58457da7766a78d2655cd332adbc56150
TAJO-191: INSERT OVERWRITE INTO statement should follow the table meta in catalog. (jinho);3e8215974d696eac96ea5ea3431e8b0082d4a1a5
TAJO-194: LogicalNode should have an identifier to distinguish each logical node instance. (hyunsik);fc018de823dd34d769eb73f3c42e089b0d992b81
TAJO-198: The split function does not work properly. (jinho);44bb57dc4913c4947dfd6c96c9b939924a29b051
TAJO-185: Implement split_part function. (hyunsik);7a2061bb924a41077f8377b3392133a13f728455
TAJO-193: Add string pattern matching operators. (hyunsik);7b0dec6a7b44fbacf582f8e8fd78d68064b42a7c
TAJO-187: The exception 'Some targets cannot be evaluated' is caused in nested joins. (hyunsik);16d1895e5f51832ce7fb9741ba4fb06c6ec2cc92
TAJO-46: The "having" clause does not work properly. (hyunsik);e595384bace80341c23575a554cd21a95fb19738
TAJO-186: Improve column resolving method. (hyunsik);bd1619de0c0a371363382540f70bd876c08ea765
TAJO-183: Creating too many TableMetaProto objects might lead a potential memory leak. (jihoon);693caefc064c55a4bfb5ba5ed8654d737e6a6f4d
TAJO-184: Refactor GlobalPlanner and global plan data structure. (hyunsik);1b1d1e8c1a6b82ccc5c3ce4daeb9e3daa309cde4
TAJO-119: Refactor and Improve Datum. (jinho);53df7f45594b29ee12d3242720db769419f4d771
TAJO-181: Improvement of disk scheduler policy for straggler disk. (hyoungjunkim via hyunsik);3915d85e98f00c629e064af26dd3551f29c52437
TAJO-178: Implements StorageManager for scanning asynchronously. (only fixed CHANGES.txt);f664e0ccfc59d31b3fab816f935730da53a484bf
TAJO-178: Implements StorageManager for scanning asynchronously. (hyoungjunkim via hyunsik);5ad7fbae98e45307cde51bc58d54e4de95b627ad
TAJO-168: infinite loop occurs when QueryMaster is stopping. (jinho);5d3966a8cd4c3256abf47d4a9084adc7778e8da3
TAJO-180: Better error messages for StorageManager.listStatus$InvalidInputException. (hyunsik);3b595ddd389c819ebe79b0c7ba9a6427b153526a
TAJO-177: Call by reference bug in MergeJoinExec. (jihoon);5fb4931264479c8d81ace16948fa8f956239c084
TAJO-171: BitArray always returned false. (jinho);473347e334d5d55bf0fe160e07480865114a361a
TAJO-172: TajoWorker allocate wrong container slots.(jinho);23c046990d5d57ac7642d267762e76d1f3e56837
TAJO-174: SQL error handler sometimes occurred NPE. (jinho);2a26edffed8a309ab53f6d253b813e07fa53c245
TAJO-170: mvn compile error when building tar file. (jaehwa);74c369ee2bb7d721f09243bd84f6afa5cb0f7b28
TAJO-170: mvn compile error when building tar file. (jaehwa);7839b16456a0d08119fc0c5269a67c3b70ca802c
TAJO-170: mvn compile error when building tar file. (jaehwa);27a4f5f947c82a5ac1d1c17bafe1753dca3ccf3c
TAJO-101: HiveQL converter (jaehwa);d27e51ee51abc132190e070b0e0a7c5219156e0b
TAJO-167: Implement GeneralSetFunctionExpr to represent all SQL standard set functions. (hyunsik);d33dfb27641c20e074c035ea66795b7fb37c9209
TAJO-154: Query calculates wrong progress in multiple step queries. (hyunsik);30ab48b061fcaefd232544b084e490f04d76de15
TAJO-149: Eliminate QueryConf and its file write. (hyunsik);27f76811c4dc279cd2887adf900466c3dba402b3
TAJO-152: The tajo local directory path is mismatched in PullServer. (jihoon);e448b5efc91afea8dcdf96a7b144cecbe08b3fa6
TAJO-80: Remove codes of legacy data paths. (jihoon);14d1f87dec16ae9be436a8e5b0bd518851eeadce
TAJO-159: QueryMaster cannot connect the remote CatalogServer. (hyunsik);29ecb62b591cb64176b40600e34d36c011a0d506
TAJO-158: Can't allocate worker when single SubQuery requests more than cluster capacity. (hyoungjunkim via hyunsik);0b513ca07988ae1f008c9a47db993f3bc6ef43cc
TAJO-157: The CSVScanner.isSplittable() function does not work properly. (jinho);68d72cf529f688bcef37fee38188d4d593315f45
TAJO-144: Implement INSERT OVERWRITE clause. (hyunsik);ffdb1c71cf796adafb635b99e80b8764a7b201ea
TAJO-156: BufferUnderflowException occurs during processing the intermediate file. (jinho);b2dc84fe7cae0b265f2ba11a7b2511d760ccf73f
TAJO-141: Multiple union queries within a table subquery causes NPE. (hyunsik);fb37ff33cfaac9d46d2aaa62a9ad64abfc01ee2a
TAJO-139: In predicate support. (hyunsik);3703a7c3617584f157d485f735e374f17d9f27fd
TAJO-134: Support for compression/decompression of CSVFile. (jinho);bc8e1804c8ec5e02f09c77a2cfe977520f76278d
TAJO-143: Implement hash semi-join operator. (hyunsik);156b91ab7b5d1813b3fc2974e2f505e2bd5950c0
TAJO-142: Implement hash anti-join operator. (hyunsik);0f3965a0005fb6f041d487b5ce75f3ef6dc2d8e3
TAJO-94: Remove duplicate proto files. (hyunsik);2056211681697aa57e7520f1112e60d56c45e497
TAJO-141: Set on demand as the default cluster mode. (hyunsik);466adcc57f19005c6f3a9bbbc5cbf09a3d77fdc4
TAJO-137: Unreleased resources and wrong allocation requests in TajoWorkerResourceManager. (hyoungjunkim via hyunsik);ce84eba436aaf639920bb38ff8d5081d01c23686
TAJO-59: Implement Char Datum Type. (jihoon);4e47471c3c72756821c26c6817611b6cc51c71b4
TAJO-136: Broadcast join should be enabled. (hyunsik);a09ac15ca326928ed4aa36af25fc85a603fdd05c
TAJO-127: Implement Tajo Resource Manager. (Fixed some missing changes);c027cd271be619f7a19b2f8f91a673099bca25ea
TAJO-127: Implement Tajo Resource Manager. (hyoungjunkim via hyunsik);d48f2667b822564260b6e5c9705a41e5dcd1c4fc
TAJO-84: Task scheduling with considering disk load balance. (jinho);8b8b6683d86ca7d3362ad2c16644f6656d4e129d
