message;sha
TAJO-834 : tablePath.getName() should be tableName in StorageManager.split()--Change-Id: I100eb41205dc7a083e6fcc853692b33bdf16ac0f-Reviewed-on: https://dbserver.korea.ac.kr/reviews/262-Tested-by:  Jenkins <build@dbserver.korea.ac.kr>-Reviewed-by: Hyunsik Choi <hyunsik.choi@gmail.com>;a573013bb91a5f2fbb09e5f64c692bd529737dd8
TAJO-837: tabletSet ? fragment  add ?.--Change-Id: I00f0a7f737555aa4490edee1d75eff6cea476cfa-Reviewed-on: https://dbserver.korea.ac.kr/reviews/261-Tested-by:  Jenkins <build@dbserver.korea.ac.kr>-Reviewed-by: Hyunsik Choi <hyunsik.choi@gmail.com>;9cfea46ff2ffe113dad5b50714d42c3ea5f48c1f
TAJO-836: Rename some Enums in CatalogProtos.proto.--Change-Id: I9f250aeaeb7cfafee0941d78da3eb0d04a45d2a3-Reviewed-on: https://dbserver.korea.ac.kr/reviews/259-Tested-by:  Jenkins <build@dbserver.korea.ac.kr>-Reviewed-by: Hyunsik Choi <hyunsik.choi@gmail.com>;8d110793c057de6f736a498ab6be22d542a740c6
    TAJO-756 StringIndexOutOfBoundsException occurs--Change-Id: Ief1a7d0f7d169f4efe309c86cc60cf4503bddf38-Reviewed-on: https://dbserver.korea.ac.kr/reviews/258-Tested-by:  Jenkins <build@dbserver.korea.ac.kr>-Reviewed-by: Hyunsik Choi <hyunsik.choi@gmail.com>;43b914f2af56658272f24155301a2456005a6355
TAJO-832: Add log message to print the number of assigned tasks for each worker--Change-Id: I03e7d3f9f5523310ec4ae12ff571eb33a144a520-Reviewed-on: https://dbserver.korea.ac.kr/reviews/257-Tested-by:  Jenkins <build@dbserver.korea.ac.kr>-Reviewed-by: Hyunsik Choi <hyunsik.choi@gmail.com>;ca3765848a9ca4b3b36db845467157c55c03d958
TAJO-831 : Wrong logs were printed from Fetcher--Change-Id: I8692abbe493ead0473b9cdae25b5a4613549d909-Reviewed-on: https://dbserver.korea.ac.kr/reviews/256-Tested-by:  Jenkins <build@dbserver.korea.ac.kr>-Reviewed-by: Hyunsik Choi <hyunsik.choi@gmail.com>;e7460bdd0bdbdab8cdfc285fedb7fd14a677c563
TAJO-828: Selection with "is null" is incorrect--Change-Id: I4b07a63d28c54b781c532515e523cca08ebdab3b-Reviewed-on: https://dbserver.korea.ac.kr/reviews/255-Tested-by:  Jenkins <build@dbserver.korea.ac.kr>-Reviewed-by: HyoSeok Ryu <ohmyhaker@gmail.com>-Tested-by: HyoSeok Ryu <ohmyhaker@gmail.com>-Reviewed-by: Hyunsik Choi <hyunsik.choi@gmail.com>;9ca07fcd36cbea7995dab5d99e5084bcd07d5ed4
TAJO-829: Reduce log messages about the query submission and in-progress reports--Change-Id: Iaf43cce1d89c9e07098c94e15e6d71c8cfdf97cc-Reviewed-on: https://dbserver.korea.ac.kr/reviews/254-Tested-by:  Jenkins <build@dbserver.korea.ac.kr>-Reviewed-by: Hyunsik Choi <hyunsik.choi@gmail.com>;16cff89ebc641cb51dd240ed10546f50bbf71c26
TAJO-813 : TajoCli ? ?  --Change-Id: Iaba593ed97a082879c7bc4cee7518f5a7614b54b-Reviewed-on: https://dbserver.korea.ac.kr/reviews/253-Tested-by:  Jenkins <build@dbserver.korea.ac.kr>-Reviewed-by: Hyunsik Choi <hyunsik.choi@gmail.com>;1ac97320dd839f250d2cbebcfaffe57b639fea33
TAJO-827: TPC-H Q12 incurs InvalidEvalException--Change-Id: Ie80c15ef7e81d25a175fb089b3f98046ec5a9e9d-Reviewed-on: https://dbserver.korea.ac.kr/reviews/252-Tested-by:  Jenkins <build@dbserver.korea.ac.kr>-Reviewed-by: Hyunsik Choi <hyunsik.choi@gmail.com>;4c8ae31d766357dcba4bfbfb22d141e131e4046b
TAJO-826: During processing TPC-H Q3, UniformRangePartition incurs IllegalArgumentException.--Change-Id: Ie4977497156f63fa9fe7ffcc84e2d38d8b81d30a-Reviewed-on: https://dbserver.korea.ac.kr/reviews/251-Tested-by:  Jenkins <build@dbserver.korea.ac.kr>-Reviewed-by: Hyunsik Choi <hyunsik.choi@gmail.com>;c75e9205a695e4ad3ff5456a6bb0b8d3a4d39497
TAJO-825: During processing Q14, CaseWhenEval incurs NPE--Change-Id: Ibc4e3a13118156af475e9f6aa79c277c32e2734e-Reviewed-on: https://dbserver.korea.ac.kr/reviews/250-Tested-by:  Jenkins <build@dbserver.korea.ac.kr>-Reviewed-by: Hyunsik Choi <hyunsik.choi@gmail.com>;6346c4fa6ce0ae834cfac4b1d008837ec2845cc9
TAJO-824: Implement IsNullEval (add missing unittest and fix trivial bugs).--Change-Id: Iadbf6d9c71dd614776168de4698f997d2dc5c8f9-Reviewed-on: https://dbserver.korea.ac.kr/reviews/249-Tested-by:  Jenkins <build@dbserver.korea.ac.kr>-Reviewed-by: Hyunsik Choi <hyunsik.choi@gmail.com>;f761968f5193baa2a67602cb2b8abf459c43f959
TAJO-824: Implement IsNullEval--Change-Id: I83950b459c4f026380a8d03faa153a9a5d4d30a5-Reviewed-on: https://dbserver.korea.ac.kr/reviews/248-Tested-by:  Jenkins <build@dbserver.korea.ac.kr>-Reviewed-by: HyoSeok Ryu <ohmyhaker@gmail.com>-Tested-by: HyoSeok Ryu <ohmyhaker@gmail.com>-Reviewed-by: Hyunsik Choi <hyunsik.choi@gmail.com>;596a1ef1957111d4a5449332d559e96744a19b07
TAJO-823: Add NULL parsing rule--Change-Id: I4342ef9e5c3c69299c2b3ac110a2993b6edd8ace-Reviewed-on: https://dbserver.korea.ac.kr/reviews/247-Tested-by:  Jenkins <build@dbserver.korea.ac.kr>-Reviewed-by: Hyunsik Choi <hyunsik.choi@gmail.com>;253d574702829420e47a8346783262d75177276a
TAJO-820: When 'on' join condition has selection condition, GlobalPlanner uses wrong partition keys.--Change-Id: Id7a7b1fdf9d7232a92b95b6cc6b68238fab63d01-Reviewed-on: https://dbserver.korea.ac.kr/reviews/246-Tested-by:  Jenkins <build@dbserver.korea.ac.kr>-Reviewed-by: Hyunsik Choi <hyunsik.choi@gmail.com>;c31536890ab81997a9c4be72c32aa2bc9993338b
TAJO-819: Make MergeJoinExec to check the join condition--Change-Id: I99f803f0130e3ccdac4e0277426562662092f4ca-Reviewed-on: https://dbserver.korea.ac.kr/reviews/245-Tested-by:  Jenkins <build@dbserver.korea.ac.kr>-Reviewed-by: Hyunsik Choi <hyunsik.choi@gmail.com>;15a897ee153a0e83f9c5bc0246fd87db05e67796
TAJO-817: Improve explicit join and modify the right-deep join tree to the left-deep join tree--Change-Id: I359fabd008f48ed6802dd9acc4acadf1decc3cdd-Reviewed-on: https://dbserver.korea.ac.kr/reviews/243-Tested-by:  Jenkins <build@dbserver.korea.ac.kr>-Reviewed-by: Hyunsik Choi <hyunsik.choi@gmail.com>;e8595a7eb2a3dcebfa0764cef306d24760fd3819
TAJO-814: tajo-cli always prints "executed in local mode"--Change-Id: I3e41e74b2cf21d185c13f15f5178e9ab95807033-Reviewed-on: https://dbserver.korea.ac.kr/reviews/242-Tested-by:  Jenkins <build@dbserver.korea.ac.kr>-Reviewed-by: Hyunsik Choi <hyunsik.choi@gmail.com>;7a89289e523878ffe4c843f91888f4368e55ba10
TAJO-807: TupleUtil.getPartitions incurs IllegalArgumentException of TupleRange--Change-Id: I52b23c98a8dca4e7bcd0869e2c43de7c53cbf800-Reviewed-on: https://dbserver.korea.ac.kr/reviews/241-Tested-by:  Jenkins <build@dbserver.korea.ac.kr>-Reviewed-by: Hyunsik Choi <hyunsik.choi@gmail.com>;2ac7695ab9e0a3d76f87d078076c197ebd93ccf8
TAJO-812: Add tajo.engine.sortbuffer to configuration--Change-Id: Ibfafa0dfc02e08e912c3ffdbbebdb13e58028766-Reviewed-on: https://dbserver.korea.ac.kr/reviews/240-Tested-by:  Jenkins <build@dbserver.korea.ac.kr>-Reviewed-by: Hyunsik Choi <hyunsik.choi@gmail.com>;6cbcc8c4189d224a1fb1a3fef2366c5ec978e972
TAJO-810 ??     --Change-Id: I1b8914a6d34a56d8650855c059120663d9b55041-Reviewed-on: https://dbserver.korea.ac.kr/reviews/239-Tested-by:  Jenkins <build@dbserver.korea.ac.kr>-Reviewed-by: Hyunsik Choi <hyunsik.choi@gmail.com>;d32154d60f18fc22994b1b851119bce1297881de
TAJO-805: TupleUtil.queryToRange() incurs BufferUnderflowException (fixed bugs)--Change-Id: Iaa297b17173e4fd32cd3dd207f3f55ad1cb37adb-Reviewed-on: https://dbserver.korea.ac.kr/reviews/238-Tested-by:  Jenkins <build@dbserver.korea.ac.kr>-Reviewed-by: Hyunsik Choi <hyunsik.choi@gmail.com>;fe1dd117fe24afad4deee91ddf2a5cb758e1f476
TAJO-805: TupleUtil.queryToRange() incurs BufferUnderflowException--Change-Id: If52f75592f8ec672feb32765961a614033661b19-Reviewed-on: https://dbserver.korea.ac.kr/reviews/237-Tested-by:  Jenkins <build@dbserver.korea.ac.kr>-Reviewed-by: Hyunsik Choi <hyunsik.choi@gmail.com>;272e4c98b936d9d0e0126f60d95c26ba9e0232db
    TAJO-737  ? query ?  master client --    Change-Id: I1dd9f381df5ae8ac010e501f42bd97aef845cc92--Change-Id: I46df0e52db42c8a83ddd7258422bcdf952b5e363-Reviewed-on: https://dbserver.korea.ac.kr/reviews/236-Tested-by:  Jenkins <build@dbserver.korea.ac.kr>-Reviewed-by: Hyunsik Choi <hyunsik.choi@gmail.com>;8dfe97bfa794a8290848f991cd28ff8a1f57484a
TAJO-802: StatisticsUtil.aggregate incurs NPE--Change-Id: I0f84a623952a21f645521dd9aa6baaeaddeff0f4-Reviewed-on: https://dbserver.korea.ac.kr/reviews/234-Tested-by:  Jenkins <build@dbserver.korea.ac.kr>-Reviewed-by: Hyunsik Choi <hyunsik.choi@gmail.com>;5893e74978d99d25b40af4ae465471493abbb89e
TAJO-801: ColumnStat should keep original min/max values instead of long--Change-Id: I09a2ad5b2375a952d815d0cd580a44f8b67f0c6e-Reviewed-on: https://dbserver.korea.ac.kr/reviews/233-Tested-by:  Jenkins <build@dbserver.korea.ac.kr>-Reviewed-by: Hyunsik Choi <hyunsik.choi@gmail.com>;94b25a9a983a6dedeb240d635fc2f47cf23bc6ed
TAJO-789: IndexOutOfBoundsException in engine.LeafServer--Change-Id: I38335ac70014931358107142c212abebf4ed932d-Reviewed-on: https://dbserver.korea.ac.kr/reviews/232-Tested-by:  Jenkins <build@dbserver.korea.ac.kr>-Reviewed-by: Hyunsik Choi <hyunsik.choi@gmail.com>;915f777f577af98edab0daba0bd7138637257b01
TAJO-800: Worker  ?  ?  finalize   ? ?? --Change-Id: If296c2708209eb8e941985574baec7e267a6daf0-Reviewed-on: https://dbserver.korea.ac.kr/reviews/231-Tested-by:  Jenkins <build@dbserver.korea.ac.kr>-Reviewed-by:  jihoon <jihoonson@korea.ac.kr>;ef3aea625e877542744371c3ce9e8692f8cc8b04
TAJO-798: When no grouping field aggregation is planned, the number of final query's units should be one--Change-Id: Ic24ed92dd18622778ebc0ba51fe0876967226e12-Reviewed-on: https://dbserver.korea.ac.kr/reviews/230-Tested-by:  Jenkins <build@dbserver.korea.ac.kr>-Reviewed-by: Hyunsik Choi <hyunsik.choi@gmail.com>;6616df7d38b6a4ad2581a45eef537b914ec75f86
TAJO-788: the order-by clause of TPC-H Q1 incurs NPE--Change-Id: I7534a8e65c4b4467c9f6ac9107ac0b9bb4986989-Reviewed-on: https://dbserver.korea.ac.kr/reviews/229-Tested-by:  Jenkins <build@dbserver.korea.ac.kr>-Reviewed-by: Hyunsik Choi <hyunsik.choi@gmail.com>;5a8176de8f52ac5c2fe3f668bcbcbd4059adf9d2
TAJO-795: Enclose the sql logs of DBStore into the isDebugEnabled condition--Change-Id: I5517ff2249623b6739ca4f752f857c808face986-Reviewed-on: https://dbserver.korea.ac.kr/reviews/228-Tested-by:  Jenkins <build@dbserver.korea.ac.kr>-Reviewed-by: Hyunsik Choi <hyunsik.choi@gmail.com>;06161b54137354a6c9c9eda0b8a8f567f96c3095
TAJO-794: Bump up the version to 0.1.6-SNAPSHOT--Change-Id: Ie9da7e5af99883c2b12d0487c8115a7d112d596a-Reviewed-on: https://dbserver.korea.ac.kr/reviews/227-Tested-by:  Jenkins <build@dbserver.korea.ac.kr>-Reviewed-by: Hyunsik Choi <hyunsik.choi@gmail.com>;f3b7cc26b17a9ce543426928108a65d2a5040339
TAJO-793: Bump up the version to 0.1.5-SNAPSHOT--Change-Id: I25e4542e14937a88a89f0e125f065ad73bbc4236-Reviewed-on: https://dbserver.korea.ac.kr/reviews/225-Tested-by:  Jenkins <build@dbserver.korea.ac.kr>-Reviewed-by: Hyunsik Choi <hyunsik.choi@gmail.com>;d9dc5e669aa52440e06687e64302d91eafda565a
TAJO-787: Extend EvalNode to return one or more values--Change-Id: Ifbebe7ed348ebc650c055ccd8b183c0a6ef47848-Reviewed-on: https://dbserver.korea.ac.kr/reviews/224-Tested-by:  Jenkins <build@dbserver.korea.ac.kr>-Reviewed-by: Hyunsik Choi <hyunsik.choi@gmail.com>;bbe75799bc0739abff2afe898d9b8b3721776e40
TAJO-792: QueryUnitScheduler? Backup task   ? ?  ? ?? --Change-Id: If6ce3b2936a5541717f91e34fb1b735922f65657-Reviewed-on: https://dbserver.korea.ac.kr/reviews/223-Tested-by:  Jenkins <build@dbserver.korea.ac.kr>-Reviewed-by: Hyunsik Choi <hyunsik.choi@gmail.com>;044bbbddece34d80ea946ec2b6cda5f1429b78af
TAJO-781: Implement expression transformation for merge phase--Change-Id: I0b684b0b08a3a622e1cbbd4424fc21c8ea9beab1-Reviewed-on: https://dbserver.korea.ac.kr/reviews/222-Tested-by:  Jenkins <build@dbserver.korea.ac.kr>-Reviewed-by: Hyunsik Choi <hyunsik.choi@gmail.com>;15fa4333d7c687c34f9e1e37c9eaca14f1d2adda
TAJO-593: local hash join  (fixed unittest errta)--Change-Id: I1cb8633c0e4a682f412d51ed2ece927ad349c455-Reviewed-on: https://dbserver.korea.ac.kr/reviews/221-Tested-by:  Jenkins <build@dbserver.korea.ac.kr>-Reviewed-by: Hyunsik Choi <hyunsik.choi@gmail.com>;d2a202f1448ff4b91e768f8752388ee1de9bbcdf
TAJO-593 : local hash join --Change-Id: I5782a155665e7802d7f974efd7ace901f7b0324e-Reviewed-on: https://dbserver.korea.ac.kr/reviews/193-Tested-by:  Jenkins <build@dbserver.korea.ac.kr>-Reviewed-by: Hyunsik Choi <hyunsik.choi@gmail.com>;5d07bba5b2b5cdef7551fd24cc17990392d74d19
TAJO-785: Implement the advanced projection push method--Change-Id: I804ffa4d90d04e3e96a5078c1504201b9de93665-Reviewed-on: https://dbserver.korea.ac.kr/reviews/220-Tested-by:  Jenkins <build@dbserver.korea.ac.kr>-Reviewed-by: Hyunsik Choi <hyunsik.choi@gmail.com>;c53259fd4cc0f02a0f87b6bc2dabffbd0d140620
TAJO-784: Implement the evaluation tree for case statement--Change-Id: If035725752c4e61fbb5dfe8d38aa31fea7a4d20f-Reviewed-on: https://dbserver.korea.ac.kr/reviews/219-Tested-by:  Jenkins <build@dbserver.korea.ac.kr>-Reviewed-by: Hyunsik Choi <hyunsik.choi@gmail.com>;1be85225580e7655bd98bfb51f5ba14cd9df98a1
TAJO-783: Implement Parse for Case Statement--Change-Id: I3fb75dc6a11fe6fe391fd8d28ab52d7e13a7d753-Reviewed-on: https://dbserver.korea.ac.kr/reviews/218-Tested-by:  Jenkins <build@dbserver.korea.ac.kr>-Reviewed-by: Hyunsik Choi <hyunsik.choi@gmail.com>;2a7193419f0a2bb696435c2b5480e9c741943cca
TAJO-774: Refactor existing built-in aggregation functions for four steps--Change-Id: Id939fefe9ef6b3bbc47dad3c8ca5df84aa5bde5b-Reviewed-on: https://dbserver.korea.ac.kr/reviews/216-Tested-by:  Jenkins <build@dbserver.korea.ac.kr>-Reviewed-by: Hyunsik Choi <hyunsik.choi@gmail.com>;a4e99e9e7f92ccda04553de12c4867c92c0cb090
TAJO-777: Implement EvalContext that contains the states of evaluation nodes--Change-Id: I68458e4cb007654523400ac9d8374f7b490ede91-Reviewed-on: https://dbserver.korea.ac.kr/reviews/215-Tested-by:  Jenkins <build@dbserver.korea.ac.kr>-Reviewed-by: Hyunsik Choi <hyunsik.choi@gmail.com>;6dc6bcf782e78218f29ded670171719725e369e2
TAJO-778: GlobalPlanner PartitionedStoreExec?   --Change-Id: I67a2d3c702b9f30d7e1347dbe48be50cbaf75dc2-Reviewed-on: https://dbserver.korea.ac.kr/reviews/214-Tested-by:  Jenkins <build@dbserver.korea.ac.kr>-Reviewed-by:  jihoon <jihoonson@korea.ac.kr>;98aad4ae24712f1a99f7468895e9a15dd154d151
TAJO-775 : Change temporary file path to local directory--Change-Id: I70c59d0d128f2e0d886c1bbb9c186a4f36092cd3-Reviewed-on: https://dbserver.korea.ac.kr/reviews/213-Tested-by:  Jenkins <build@dbserver.korea.ac.kr>-Reviewed-by:  jihoon <jihoonson@korea.ac.kr>;8b24367cf9c2f4f33571569197d157ef8dfc79ec
TAJO-770: Refactor functions to deal with four steps--    Change-Id: I38e543ac6220b45c9679176df618b6b5bf12e6ef--Change-Id: I742ee989ac940d05bb9661dbc525f28688695bfd-Reviewed-on: https://dbserver.korea.ac.kr/reviews/212-Tested-by:  Jenkins <build@dbserver.korea.ac.kr>-Reviewed-by: Hyunsik Choi <hyunsik.choi@gmail.com>;116085cc09c10ab9fc117b65d6a23652cde3d39a
TAJO-772: WorkerListener?   --Change-Id: Ic5f0d9af764d5c55f8860cfc971fa09cbb0692bc-Reviewed-on: https://dbserver.korea.ac.kr/reviews/211-Tested-by:  Jenkins <build@dbserver.korea.ac.kr>-Reviewed-by:  jihoon <jihoonson@korea.ac.kr>;2b465239b62e1a83b576deb15430b00b11062d11
TAJO-766: Master QueryUnit? ?? ? Worker? Command   --Change-Id: Ia3cfa1e50e92d22b7924ab9f3a2ee00913e73d6f-Reviewed-on: https://dbserver.korea.ac.kr/reviews/210-Tested-by:  Jenkins <build@dbserver.korea.ac.kr>-Reviewed-by: Hyunsik Choi <hyunsik.choi@gmail.com>;300520415e8fb5d1ddaba456b08d4802de7a5476
TAJO-771: Eliminate old cube package--Change-Id: I7f8aa0ed6e803f9ce66686a040f7d35693c934ef-Reviewed-on: https://dbserver.korea.ac.kr/reviews/209-Tested-by:  Jenkins <build@dbserver.korea.ac.kr>-Reviewed-by: Hyunsik Choi <hyunsik.choi@gmail.com>;8089bcee67d1bf8a133f552e9bfa5185e7f9e0b4
TAJO-769: the types of constants should be parsed with type inference (fixed missting unittest)--Change-Id: I5ce57214fc2d1092fb2fc191a1a15077856f6927-Reviewed-on: https://dbserver.korea.ac.kr/reviews/208-Tested-by:  Jenkins <build@dbserver.korea.ac.kr>-Reviewed-by: Hyunsik Choi <hyunsik.choi@gmail.com>;10adf32363149ed810311dcce792e88c37652e4a
TAJO-769: the types of constants should be parsed with type inference--Change-Id: I8c54683c822c10ec293ab355e293174e77bfa3d2-Reviewed-on: https://dbserver.korea.ac.kr/reviews/207-Tested-by:  Jenkins <build@dbserver.korea.ac.kr>-Reviewed-by: Hyunsik Choi <hyunsik.choi@gmail.com>;bf786d23a1cba8a7a44c500f9729f68a200b4f74
TAJO-768: The prefix 'TAZO' in tajo-env.sh should be change 'TAJO'--Change-Id: I7938179a0a6ae85401e61ffa83bdf9a5252c64a4-Reviewed-on: https://dbserver.korea.ac.kr/reviews/206-Tested-by:  Jenkins <build@dbserver.korea.ac.kr>-Reviewed-by: Hyunsik Choi <hyunsik.choi@gmail.com>;b7e5c703f58ea61489ec0c1a57212bf2a12345b7
TAJO-767: Sparse tables may cause unpaired join query unit--Change-Id: I8e3acee499cff9cf1910d54f3a056141a3e629f4-Reviewed-on: https://dbserver.korea.ac.kr/reviews/205-Tested-by:  Jenkins <build@dbserver.korea.ac.kr>-Reviewed-by: Hyunsik Choi <hyunsik.choi@gmail.com>;6dc5d89a7c37ea0768d7ba1d8657c7033fb81828
TAJO-763 BSTIndex.find causes wrong search when findkey is less than the min key of the index--Change-Id: I00b8566cb45f25db0eec3132f58caf2a10235590-Reviewed-on: https://dbserver.korea.ac.kr/reviews/204-Tested-by:  Jenkins <build@dbserver.korea.ac.kr>-Reviewed-by: Hyunsik Choi <hyunsik.choi@gmail.com>;5e252665399d5024764aeefcd5b05c5b8a4b33db
TAJO-764: BSTIndex should be thread safe--Change-Id: I09f36f5388a36f7721918a04cb4f47686037ea64-Reviewed-on: https://dbserver.korea.ac.kr/reviews/203-Tested-by:  Jenkins <build@dbserver.korea.ac.kr>-Reviewed-by: Hyunsik Choi <hyunsik.choi@gmail.com>;a30a54cc2df56d51bae1e54cad6a113e8c750516
TAJO-762: fix the missing final value of RangeRetriverHandler--Change-Id: I1490f35758cfeae074470f66ede1bd927c7740a3-Reviewed-on: https://dbserver.korea.ac.kr/reviews/202-Tested-by:  Jenkins <build@dbserver.korea.ac.kr>-Reviewed-by: Hyunsik Choi <hyunsik.choi@gmail.com>;17b290157cfb9ea7c6838b8768340d23b4e1bb18
TAJO-761: Fix bugs of distributed sort--Change-Id: Icf36fbb70b98f1a4c3c5b7905d5aa25d1e85f52e-Reviewed-on: https://dbserver.korea.ac.kr/reviews/201-Tested-by:  Jenkins <build@dbserver.korea.ac.kr>-Reviewed-by: Hyunsik Choi <hyunsik.choi@gmail.com>;fa28afd0c30000e440bdbcc00fe31c18ab15be1e
TAJO-758: Implement Global Planning for distributed sort--Change-Id: I54c1d2ec2c5237caa9408443c56a4235404bbfc7-Reviewed-on: https://dbserver.korea.ac.kr/reviews/199-Tested-by:  Jenkins <build@dbserver.korea.ac.kr>-Reviewed-by: Hyunsik Choi <hyunsik.choi@gmail.com>;f523951172b25cfecea3733f18bf0414c48e0c23
TAJO-759: Implement Partitioner for Column Ranges--Change-Id: I9d960bf96f250eed8842b9c3fc2365fdc822e6a8-Reviewed-on: https://dbserver.korea.ac.kr/reviews/198-Tested-by:  Jenkins <build@dbserver.korea.ac.kr>-Reviewed-by: Hyunsik Choi <hyunsik.choi@gmail.com>;1471071e4363227318c7183b4eb0fed5080d2043
TAJO-751: Implement RangeRetrieverHandler--Change-Id: Iee08dd7a68250dc05a5a79212bcc61846ee927f5-Reviewed-on: https://dbserver.korea.ac.kr/reviews/197-Tested-by:  Jenkins <build@dbserver.korea.ac.kr>-Reviewed-by: Hyunsik Choi <hyunsik.choi@gmail.com>;2a32e6ec46bb5c84407027db5ca01578ea779073
TAJO-755: Refactor InterRetriever to deal with additional fetch types--Change-Id: I63c4507403d20091efc3caf531d0f7024ea4e637-Reviewed-on: https://dbserver.korea.ac.kr/reviews/196-Tested-by:  Jenkins <build@dbserver.korea.ac.kr>-Reviewed-by: Hyunsik Choi <hyunsik.choi@gmail.com>;1831911797b12ff90e17c556201cba0d777616e4
TAJO-752: Implement IndexedStoreExec--Change-Id: Ib409b6d209f36f91c38944f9c9c5c349306e52ed-Reviewed-on: https://dbserver.korea.ac.kr/reviews/195-Tested-by:  Jenkins <build@dbserver.korea.ac.kr>-Reviewed-by: Hyunsik Choi <hyunsik.choi@gmail.com>;2256d0d00eea87b343fc7d51a9f6b9c672e67041
TAJO-754: Refator BSTIndex to be enabled to specific output dir--Change-Id: Iadeb14af5c250f84814faf665beed5d628aa7ef2-Reviewed-on: https://dbserver.korea.ac.kr/reviews/194-Tested-by:  Jenkins <build@dbserver.korea.ac.kr>-Reviewed-by: Hyunsik Choi <hyunsik.choi@gmail.com>;80192a34e2cb9258d9d21b29a30092b9c23aac78
TAJO-746 : block-nested loop join --Change-Id: Ia3cd64f69b15998a72100643165466964e79eb49-Reviewed-on: https://dbserver.korea.ac.kr/reviews/190-Tested-by:  Jenkins <build@dbserver.korea.ac.kr>-Reviewed-by: Hyunsik Choi <hyunsik.choi@gmail.com>;8d18f9e5abe8f7a3439969e4a1e4c105baeeded8
TAJO-747: Implement a basic histogram feature for sort--Change-Id: I84079ba439154682fb817b2303d997d1a1b40ac5-Reviewed-on: https://dbserver.korea.ac.kr/reviews/191-Tested-by:  Jenkins <build@dbserver.korea.ac.kr>-Reviewed-by: Hyunsik Choi <hyunsik.choi@gmail.com>;4c8cf062469d6472bb539372cd91a832afb6a967
TAJO-749: nta.cluster.distributed in NConstants should be changed to tajo.cluster...--Change-Id: Id3da7fb270908766525458fc66e81ad47e0aef31-Reviewed-on: https://dbserver.korea.ac.kr/reviews/189-Tested-by:  Jenkins <build@dbserver.korea.ac.kr>-Reviewed-by: Hyunsik Choi <hyunsik.choi@gmail.com>;afd25665008eda440f7c777a04c02b3cf87741fd
TAJO-745: an algebraic parameter of some function causes NPE--Change-Id: Id6df3c65bcd05af4c66c60a3d0e93f99be42dff7-Reviewed-on: https://dbserver.korea.ac.kr/reviews/188-Tested-by:  Jenkins <build@dbserver.korea.ac.kr>-Reviewed-by: Hyunsik Choi <hyunsik.choi@gmail.com>;7bacc091f7a3939d540dcea37aca61ba2772b181
TAJO-744: Support the planning for sort-merge join--Change-Id: Ib0e6e5b147b2225783b81070a39135801c513222-Reviewed-on: https://dbserver.korea.ac.kr/reviews/187-Tested-by:  Jenkins <build@dbserver.korea.ac.kr>-Reviewed-by: Hyunsik Choi <hyunsik.choi@gmail.com>;a4dc1075913285ad84cf5b3c0ea14548db129d48
TAJO-727 : Implement sort-merge join operator--Change-Id: Idbe12628a1075f55b99af27956f0f1f0f429ea27-Reviewed-on: https://dbserver.korea.ac.kr/reviews/179-Tested-by:  Jenkins <build@dbserver.korea.ac.kr>-Reviewed-by: Hyunsik Choi <hyunsik.choi@gmail.com>;20c91b3c73f616a142f1686f2aa4f49813b161c4
TAJO-729: join queries causes a wrong order of selection fields--Change-Id: Iaad16fe5985dd54462b22fcb9e24f423b82ed287-Reviewed-on: https://dbserver.korea.ac.kr/reviews/186-Tested-by:  Jenkins <build@dbserver.korea.ac.kr>-Reviewed-by: Hyunsik Choi <hyunsik.choi@gmail.com>;84a92be68498b56f5c8a9e626c951ac53def2acb
Removed lib directory.--Change-Id: Ie7d8b019484aaaeecc217ca79f98b99a1f0f17b1-Reviewed-on: https://dbserver.korea.ac.kr/reviews/185-Reviewed-by: Hyunsik Choi <hyunsik.choi@gmail.com>-Tested-by: Hyunsik Choi <hyunsik.choi@gmail.com>;53f93bf66f52b2ecfe5a4d2b6f46389bf0895b4c
TAJO-742: Implement an util method to transform a join key into a sort key--Change-Id: I7874175806fab48cc95545e4a9e7280a58e5dac2-Reviewed-on: https://dbserver.korea.ac.kr/reviews/184-Tested-by:  Jenkins <build@dbserver.korea.ac.kr>-Reviewed-by: Hyunsik Choi <hyunsik.choi@gmail.com>;9dbd7cb272e277e26cfdddc63a902e5e51351dd3
TAJO-739: improve the logical planning with implicit join order--Change-Id: Idc309e41a21e378a4353d62ee56255a46ac1a568-Reviewed-on: https://dbserver.korea.ac.kr/reviews/183-Tested-by:  Jenkins <build@dbserver.korea.ac.kr>-Reviewed-by: Hyunsik Choi <hyunsik.choi@gmail.com>;2ee861e1f412548f6ff72c4c7920c0837e5b3fd8
TAJO-495 Web Interface  API--Change-Id: Ic24fe70477015454e0319584172396e2f9016b50-Reviewed-on: https://dbserver.korea.ac.kr/reviews/110-Tested-by:  Jenkins <build@dbserver.korea.ac.kr>-Reviewed-by: Hyunsik Choi <hyunsik.choi@gmail.com>;d4ff1c8114a05508e2ed7119a20c11d510e0dd5f
TAJO-735: Change intermediate file of external sort to RawFile--Change-Id: I53c4379cd9ced848b05c21c1a5ef8d2440dc2926-Reviewed-on: https://dbserver.korea.ac.kr/reviews/182-Tested-by:  Jenkins <build@dbserver.korea.ac.kr>-Reviewed-by: Hyunsik Choi <hyunsik.choi@gmail.com>;199c939e8f4c4ab37dcc48911f8370abb477caa5
TAJO-738: Add simple benchmark queries to evaluate the basic operators--Change-Id: I65a5084f6212ec742021e004effd0a0e19901919-Reviewed-on: https://dbserver.korea.ac.kr/reviews/181-Tested-by:  Jenkins <build@dbserver.korea.ac.kr>-Reviewed-by: Hyunsik Choi <hyunsik.choi@gmail.com>;f060d254a7a03e67c1f97f90d251610bfe2400b2
TAJO-736: RawFile Unittests for all data types--Change-Id: Ie243cf45c1a3fe55bb46e2f200223eb51854fd76-Reviewed-on: https://dbserver.korea.ac.kr/reviews/180-Tested-by:  Jenkins <build@dbserver.korea.ac.kr>-Reviewed-by: Hyunsik Choi <hyunsik.choi@gmail.com>;c584eba00658da76d199e36cc4b4ec4133c256be
TAJO-734: Remove ETL, logserver from the tajo--Change-Id: Ibef0bad87c3690a93333e033be303b48e6f46096-Reviewed-on: https://dbserver.korea.ac.kr/reviews/177-Tested-by:  Jenkins <build@dbserver.korea.ac.kr>-Reviewed-by: Hyunsik Choi <hyunsik.choi@gmail.com>;ede8d588012bf31563370caa35cb8903889494ab
TAJO-732: Add alternative aggregation algorithm to the global planning--Change-Id: I68c06e09ddd05019bcbde14ce24f49d232563d22-Reviewed-on: https://dbserver.korea.ac.kr/reviews/176-Tested-by:  Jenkins <build@dbserver.korea.ac.kr>-Reviewed-by: Hyunsik Choi <hyunsik.choi@gmail.com>;4d8c18f8a7d103c5a7bee376e8c7f672ab5aac66
TAJO-726: Implement the sort group-by operator--Change-Id: I214b10fd353e42312d1f0088848f57f38c0a3461-Reviewed-on: https://dbserver.korea.ac.kr/reviews/174-Tested-by:  Jenkins <build@dbserver.korea.ac.kr>-Reviewed-by: Byung Nam Lim <rocketclub@naver.com>-Tested-by: HyoSeok Ryu <ohmyhaker@gmail.com>-Tested-by: Haemi Yang <haemiyang@korea.ac.kr>-Reviewed-by: Haemi Yang <haemiyang@korea.ac.kr>-Reviewed-by: Hyunsik Choi <hyunsik.choi@gmail.com>;d4be525fc974c7ce56014d44d5bbcd23bb9bc6ff
TAJO-733 : TajoClient? executeQuery?   path ?    --Change-Id: I2393efb83dcb6056a6793d8c20fa680932d2ef7b-Reviewed-on: https://dbserver.korea.ac.kr/reviews/175-Tested-by:  Jenkins <build@dbserver.korea.ac.kr>-Reviewed-by: Hyunsik Choi <hyunsik.choi@gmail.com>;728a8a55603d596a135a554b2b9d4d1a3cb5b558
TAJO-731: LIKE expression causes NPE--Change-Id: Ifc8d38b26c74a54452c7244eb8f4952101780d4f-Reviewed-on: https://dbserver.korea.ac.kr/reviews/173-Tested-by:  Jenkins <build@dbserver.korea.ac.kr>-Reviewed-by: Hyunsik Choi <hyunsik.choi@gmail.com>;6cdf5224e7b4dd8c8359278023727acb87209e81
