message;sha
TAJO-1309: Add missing break point in physical operator. (jinho)--Closes #355;17c6dff4e258d93e0ffaa1cc07368b2b5d8b8aa4
TAJO-1303: CDH cannot pass hadoop version check test;0024c75e9a36c6c90ab168f002101725f753f945
TAJO-1308: QueryInprogress can not release when query is QUERY_ERROR. (jinho)--Closes #354;f80ec425dcdd8917d1408bd20f837de39e9f0c4b
TAJO-1305: With metadata storage of MySQL, columns with the same character but difference case are not allowed.--Closes #353;e22c1c57bc81e65af6a041e9f5afc9973ca70dae
TAJO-1257: ORDER BY with NULL FIRST misses some data. (Keuntae Park)--Closes #307;4d1006d56b7761500e16afe7be7826422850555a
TAJO-1307: HBaseStorageManager need to support for users to use hbase-site.xml file. (jaehwa)--Closes #350;6f07cefd224c8da420ec7ec37974917993a05fc5
TAJO-1290: Add HBase Storage Integration Documentation. (jaehwa)--Closes #352;9d749d6b798d8a3cfb5c11f0b6ad9e8f98c52fd4
TAJO-1225: Fix wrong schema name in JDBC driver. (jaehwa)--Closes #330;76ece8b874f4a0c5554e784d7bfcc1474b217c47
TAJO-1304: Can not found TextFile in catalog. (jinho)--Closes #349;1bf71f6f5b2b4dae01ed72c33e2c910804d4071f
TAJO-1299: TB and PB representations in StorageUnit are overflow--Closes #348;9553edc9ba0d6a0d4ff6e75b6be5d06aef91eddb
TAJO-1293: Tajo have to accept hostname beginning with digits.;d1a46c6b6e3d4f6c74519cffab1c0562640fb0e5
TAJO-1295: Remove legacy worker.dataserver package and its unit tests.--Closes #345;bc478ba834e9bba768155faa53f918e495a74671
TAJO-1297: Tajo Web UI does not work after TAJO-1291. (jihoon);c45d0ef02df1aa59bb54e0da0205890cc050fcff
TAJO-1296: Remove obsolete classes from tajo.master.container package.--Closes #346;5d5b152008d25d2605008cd896871b69fd472833
TAJO-1294: Add index documents. (jihoon);3308aab4b64d36b805b0b0e6cc282a6dce97f6ad
TAJO-1281: Remove hadoop-common dependency from tajo-rpc.--Closes #343;9eac34fe3121b8bc6bbe1b81ca76852ddedb2603
TAJO-1291: Rename TajoMasterProtocol to QueryCoordinatorProtocol.--Closes #342;807868bd4d1ca1c8bd3aee33d31cca3d43dd2273
TAJO-1251: Query is hanging occasionally by shuffle report. (jinho)--Closes #339;50a8a663c2c95f14ca59f3b01ffd79b2578f7f09
TAJO-1286: Remove netty dependency from tajo-jdbc--Closes #341;533601eac6a21251485576ba693635d1650b63a4
TAJO-1287: Repeated using of the same order by key in multiple window clauses should be supported. (Keuntae Park)--Closes #337;03801a3129301745e16f0a7b40102a56e9d13389
TAJO-1282: Cleanup the relationship of QueryInProgress and QueryJobManager.--Closes #334;307c6c9f558ae96ffa2f7351ffa3dc5788ba4dbb
TAJO-1258: Close() for classes derived from FileAppender should be robust. (Jongyoung Park via jinho)--Closes #340;809cba3758564acd4def17928f95de7b4c913c45
TAJO-1288: Refactoring org.apache.tajo.master package.--Closes #338;1c29c1cb4bd0e2d75954575717cb5cf05875fe51
TAJO-1265: min(), max() does not handle null properly. (Keuntae Park)--Closes #315;a1e03289b35d34115a449ab7d81b946f69400210
TAJO-1279: Cleanup TajoAsyncDispatcher and interrupt stop events. (jinho)--Closes #331;6582d8656a3e8147984a86a9e62688b52ec1f681
TAJO-1285: Refactoring Magic Number to HAConstants. (DaeMyung Kang via jaehwa)--Closes #336;7615b7576d2d40758f55cae3f4ea3346322cef0f
TAJO-1245: Add documentation about PostgreSQL and Oracle Catalog driver. (jihoon)--Closes #333;54b2c645c454d54b6ef9ac1fb1cea621139fdf99
TAJO-1270: Fix typos. (DaeMyung Kang via hyunsik)--Closes #321;4c7d8297076c54898ce45ecbbcfbc78a592911ab
TAJO-1280: Update the roles of Hyoungjun and Jihun in web site.--Closes #332;bc8e7243e1ed1b918f90e2ba0a18d4064ee604bb
TAJO-1180: digitValue should throw Exception when char is not in valid range. (DaeMyung Kang via hyunsik)--Closes #246;203a146b278a88853054bb6bd9ad7699e7268b8a
TAJO-1228: TajoClient should communicate with only TajoMaster without TajoWorker.--Closes #317;cb9793b990f1c882e3371a44e6c3f28fe913c1a7
TAJO-1274: Merge separate pages of getting started document into a single page.--Closes #324;7a1ac28dfd75ef584f3a300afc6f119d32025e9f
TAJO-967: tajoCli doesn't remeber the last '\q' command. (Jaewoong Jung via jihoon)--Closes #325;c420ced1b8a9e777fd0d5558236050a4515d8a45
TAJO-1276: Link to tsql guide 404s in tajo cli. (Jakob Homan via jihoon)--Closes #328;14e7529e3a414766d5337919f377effaccf9ac4c
TAJO-1275: Optimizer pushs down non-equi filter as theta join qualifier--Closes #327;9e329a5509b71fa412299169dd3c866e54f46c77
added a missing commit log to CHANGES;5a97079cef13803a636de58e3e0bbcee568bc3ca
TAJO-1176: Implements queryable virtual tables for catalog information--Closes #273;021a6f0b216ca9f67a5a889e72d2a8ce81c047f2
TAJO-269: Protocol buffer De/Serialization for LogicalNode.--Closes #322;32be38d41affc498b01286938f3fea89a8def1a9
TAJO-1272: Change snapshot version from 0.9.1 to 0.10.--Closes #323;6fde9e598b575b817e3086347b3ea5c2d700a931
TAJO-920: Add FIRST_VALUE and LAST_VALUE window functions. (Keuntae Park via hyunsik)--Closes #308;fd49bff19dd27262cc7abdd4bbf3cd0d5de14dfb
TAJO-1266: Too many logs when writing a parquet relation. (DaeMyung Kang via jihoon)--Closes #320;4c713fb40464f651994926d3f56205e2e7cc2552
TAJO-1267: Remove LazyTaskScheduler. (DaeMyung Kang via jihoon);533e709b75ab7cf8bc8a06b48870dcf2ebc8fe11
TAJO-1268: tajo-client module should not use UserGroupInformation.--Closes #318;db549655034c1eb79d8f5785bc00aeecfc53a593
TAJO-1249: Tajo should check if a file format given in DDL is supported. (DaeMyung Kang via hyunsik)--Closes #313;09cad22ee2f7c30a0f28ebe50e00612777e69c86
TAJO-1259: Change tsql history behavior. (Jaewoong Jung via hyunsik)--Closes #316;c39ed5dc9e5b6ec80a87baf08d79fbb640fb886f
TAJO-1262: Rename the prefix 'SubQuery' to 'Stage'.--Closes #314;3c833e2a8c3ff7ff8a2e1b4497afb390098856bf
TAJO-1250: RawFileAppender occasionally causes BufferOverflowException. (jinho)--Closes #303;cf66a390060c79ba757097886703e30f93d31401
TAJO-1261: Separate query and ddl execution codes from GlobalEngine.--Closes #312;a4c3484232e139d4d21d0cfb9c31e5d784de652b
TAJO-1259: A title in catalog configuration document is different from others. (Jongyoung Park via hyunsik)--Closes #310;3413107469a3ce9eb9cf46b1ad3b81bbd4f97d9a
TAJO-1247: Store type 'TEXTFILE' should be TEXT while keeping enum 'TEXTFILE' in protobuf. (DaeMyung Kang via hyunsik)--Closes #302;b7c8cf7239483c6b44925175658f21dbbf252665
TAJO-1232: Implicit groupby queries with LIMIT lead to wrong results. (jihoon);af4083bfd337bfd6fe8278b0363c987d19088e50
TAJO-324: Rename the prefix 'QueryUnit' to Task.--Closes #306;5c852b7984ba96cd60d528dd2086e2745cc8e3f5
TAJO-1254: Fix getProgress race conditions in Query. (jinho)--Closes #304;ff57c77ea6ea790a0689b59272600325e5b73345
TAJO-1221: HA TajoClient should not connect TajoMaster at the first. (jaehwa)--Closes #286;2548768cfed8f018727f6f054317b2adb4d7f485
TAJO-1252: PathValidator should allow hdfs paths which contain IP addresses. (jihoon);e025e3cbe80ab39ca963333a7d4d71edea22ce0b
TAJO-1246: HBase info port conflict occasionally causes unit test failures in Jenkins CI.--Closes #300;82dfb17ca9878de90ab6b92b0c56a918789191cb
Fix the rat checking of TAJO-1242;5e043bd87bc6f84848d0745f435706421932cf60
Fix the broken unit test of TAJO-1242;bee0fd86e07a77237c0644f708c220d7ed7fafe8
TAJO-1242: Json scanner can not read some case of trucated text. (jinho)--Closes #296;c665ae1f6fc1e35e6a743e7e4e377c7885686b32
Fix a wrong documentation link in user doc.;5d9a130b7bb306ce49202f79704ec10e960829d4
TAJO-1239 ORDER BY with null column desc miss some data. (Hyoungjun Kim via hyunsik)--Closes #299;c7dd002a6e12b569e830396f84a32c832bf1e783
Add missed a commit log to CHANGES.;06ed5dc9e086d25fb2f4f4fc1595ccd0d1320079
TAJO-1233: Merge hbase_storage branch to the master branch. (Hyoungjun Kim via hyunsik)--Closes #288;4561711f0417eb3ee303f292b8ac44e4ecad8271
TAJO-1241: Change documentaiton url of devel and current versions.--Closes #295;758927e5aed12d390b02198525b812b838cd2ba3
Change documentaiton url of devel and current versions.;3c273b52dece0ed482775ec5b948a05da3116c77
TAJO-1243: *-site.xml.template should have default configs commented out.--Closes #297;876adcfbe358c6d91d9a50ba81847ebba1f0184d
TAJO-1244: tajo.worker.tmpdir.locations should use a validator for a list of Path.--Closes #298;adb34bdf84299228037d7706bf0c0209c3577846
TAJO-1143: TajoMaster, TajoWorker, and TajoClient should have diagnosis phase at startup--Closes #280;a0d67bb60ea995dc2c0ad014a8b71852e936cd56
TAJO-1238: Add SET SESSION and RESET statement.--Closes #294;4bcd46427131c09bed9898a552efe416bbdbf442
TAJO-1235: ByteBufLineReader can not read text line with CRLF. (jinho)--Closes #289;bebc78011798cd2fd691e8901141e94f1d445d6e
TAJO-1237: Fix missing maven-module for pullserver. (jinho)--Closes #293;72256fcff2c77222e278cb690efb8f669e926a29
Updating outdated affiliations.;ac6799f0ebfdd56b484611ea28dada8880406d19
TAJO-1236: Remove slow 'new String' operation in parquet format. (jinho)--Closes #292;661c7e216d664c71d2c889082703ecc6ae028dc3
TAJO-1196: Unit test hangs occasionally and randomly. (jihoon);8f68b4bafdbb216365459d5bd118534d0031e548
TAJO-1230: Disable ipv6 support on JVM. (Jihun Kang via hyunsik)--Closes #291;88e5c9e9a5cc067f7cc95899cd21394f2a2243c9
TAJO-1229: rename tajo-yarn-pullserver to tajo-pullserver.--Closes #284;b5aa780460fcfbf657541ee6c94d41b34b1b24b9
TAJO-1234: Rearrange timezone in date/time types.--Closes #290;facd1ddcc85a088ab8ba4e42dce2c99f6fe7e5de
TAJO-1213: Implement CatalogStore::updateTableStats. (jaehwa)--Closes #285;95cf4b9432a02fdbf9880b204c3db718e2bd2468
TAJO-1231: Implicit table properties in session is not stored in table property.--Closes #287;ab2efce8fb4015523a9a818f0e03fa57c6366585
TAJO-1194: 'INSERT OVERWRITE .. SELECT' does not remove existing data when result is empty. (missing code);2a69bcc218a53eced0cdb9217de1fdd1837c0827
TAJO-1194: 'INSERT OVERWRITE .. SELECT' does not remove existing data when result is empty. (jaehwa)--Closes #254;f6da07b03587d2bce5ca4ac53d86eae3a8ba23c2
TAJO-1191: Change DateDatum timezone to UTC. (Jaewoong Jung via hyunsik)--Closes #278;97507e45883c9db2fec2f5a9a9e544384a86ccd0
TAJO-1224: When there is no projected columns, json scan can be hang.--Closes #281;9f8be1a695298e2e9fe0d881ddfcb310b5a7460b
TAJO-1223: Wrong query verification against asterisk and more expressions in select list.--Closes #279;20d1f0145b47e6c478bb55c79d670926e66f137c
TAJO-1220: Implement createStatement() and setEscapeProcessing() in  JdbcConnection. (YeonSu Han via hyunsik);ea2dbf82c04d609dac46abd322241a15ccf30956
TAJO-1222: DelimitedTextFile should be tolerant against parsing errors.--Closes #277;f69938abecd3d53968e318d97aba53d9acd3de40
TAJO-1183: Keep command execution even with errors. (Jaewoong Jung via hyunsik)--Closes #266;5066ac3e80da390ff0f5733d345cbc63ec252843
TAJO-1190: INSERT INTO to partition tables may cause NPE.--Closes #250;1cdbe467e3dc25d7af59afc116ff9e8e6273a1ac
TAJO-1211: Staging directory for CTAS and INSERT should be in the output dir.--Closes #274;b4adc18cd25de550fe04a43ef69d715c146976db
TAJO-1210: ByteBufLineReader does not handle the end of file, if newline is not appeared. (jinho)--Closes #272;bf68b770e6abbb4c63d696e264a348bb1ddb5982
TAJO-1095: Implement Json file scanner.--Closes #181;cd38dffb908a3959472f5ddb705db71d0e48ad89
TAJO-1119: JDBC driver should support TIMESTAMP type. (jaehwa);7d41c67ca94493e38c67e62663dc097358a18539
TAJO-1165: Needs to show error messages on query_executor.jsp. (Jihun Kang via jaehwa);4637f7fd126c46f0e6a4bcdf2d816511b690552b
TAJO-1204: Remove unused ServerName class. (DaeMyung Kang via jaehwa);f3291621c31bbc24aff47dbc363ddfe2a1a9b21c
TAJO-1209: Pluggable line (de)serializer for DelimitedTextFile.--Closes #1209;72dd29c520981a3ffaac2150ee7306ca41192893
TAJO-1053: ADD PARTITIONS for HCatalogStore. (jaehwa);3ae44b1d2a1cf49123eb1d1c30f081a8a8d0e7fb
TAJO-1166: S3 related storage causes compilation error in Hadoop 2.6.0-SNAPSHOT. (jaehwa)--Closes #262;3d485ecb0112af12258a5a2bdc4a400b8df4fae8
TAJO-1188: Fix testcase testTimestampConstructor in TestTimestampDatum. (DaeMyung Kang via hyunsik);0c97fc0319b0f33c3a76f591d48cb52f1df92567
TAJO-1163: TableDesc should use URI instead of Path.--Closes #235;f6e09a5ae6f35dd6fe7f9ae895f0517f902b9b4d
TAJO-1208: Failure of create table using textfile on hivemeta. (jinho)--Closes #270;a56f8b53b264ed3e0554e68b3f0a51e6966e2b56
TAJO-1205: Remove possible memory leak in TajoMaster. (jinho)--Closes #265;80afe993b82d57582fbeab64d20199f4dfa3d9af
TAJO-1181: Avro schema URL should support various protocols. (jinho)--Closes #252;965cbd90778e2c6872e04456e94a19dd2e4f27f5
TAJO-1200: Invalid shuffle data of multiple worker in same server. (jinho)--Closes #259;c544ffc088d685f1ad66963351d71d7a925c7025
TAJO-1197: Unit test failed: unable to create new native thread. (jinho)--Closes #255;ef282ebec579c512bbb3860a49d7322e1fb45199
TAJO-1195: Remove unused CachedDNSResolver Class. (DaeMyung Kang via jaehwa)--Closes #253;67bdc71b17b54da731eaf01b9fac51ad8983353b
TAJO-1178: Some error messages for wrong JSON queries are not so much helpful. (Jaewoong Jung via jihoon);8f38cc7b7fff0f49c8a2ad5a2cafab783ea66347
TAJO-1184: Upgrade netty-buffer to 4.0.24.Final. (jinho)--Closes #248;491395a627dd527e43c469f00908dfc0f815de62
TAJO-1172: Remove Trevni storage type and its related classes (DaeMyung Kang via hyunsik)--Closes #244;95770e70bf4651b64a2ce79bd8f4bcea52d7ac90
TAJO-1177: Reduce the use of Sun proprietary API. (Jihun Kang via hyunsik)--Closes #243;a0625a620bba9781c51f2ee0f47ec0aad1c36767
TAJO-1169: Some older version of OpenJDK 1.6 does not get default timezone id. (Jihun Kang via hyunsik)--Closes #239;6059a3dd15e05cf1364cab6b90796acfa0356dea
TAJO-1179: Integration tests in TravisCI are occasionally failed due to log size.--Closes #245;2bc5e7f938b5c4e5a7712aa1d948d89beae6ef93
TAJO-1174: remove unnessary codes for blobdatum (DaeMyung Kang via hyunsik);17cb3120ed08749719515f21b741ea9551f7857b
TAJO-1156: Improve the comparison of timestamp and date types. (Jihun Kang via jihoon)--Closes #237;13af3d32febc1b2ece7a881d25ee650e50e1a64b
TAJO-1151: Implement the ByteBuffer-based De/Serializer. (jinho)--Closes #228;c193cfaa8eb50a83bbbf46624bcccb81c0cc7445
TAJO-1152: RawFile ByteBuffer should be reuse. (jinho)--Closes #224;55084a8ae29a3650409c1f1dea68223d6f1c340d
TAJO-1109: Separate SQL Statements from Catalog Stores. (Jihun Kang via hyunsik)--Closes #201;005556850e60f14d5e11ca74035b195461f31d29
TAJO-1161: Remove joda time dependency from tajo-core. (Jihun Kang via hyunsik)--Closes #233;2b8d30ca2ca4fbf1dfda58f482c952441178390d
TAJO-1162: to_char() returns "-00" second.--Closes #234;f45e74f6efd1175c4eb97dbbcd38c702e29031a0
TAJO-1026: Implement Query history persistency manager.--Closes #179;e01b00a7b05b98cc407ced04dad1c2f2144d0f88
TAJO-1128: Implement a select box for database at web interface. (Jongyoung Park via hyunsik)--Closes #222;a3e5bdd69833b87b666c1db567dbf464d84d35f7
TAJO-1149: Implement direct read of DelimitedTextFile. (jinho)--Closes #221;3e305b15fa94b1ed76dfa0e769825137ba1dfc1a
TAJO-1157: Required Java version in tutorial doc needs to be updated.--Closes #230;5a72e2f626de3a93dce0264cb24dbfcc00a1cd83
TAJO-1154: TajoCli doesn't pause while running the non-forwarded query. (Hyoungjun Kim via hyunsik)--Closes #227;d65224293671501639772db2141a316752078d76
TAJO-1129: Remove hadoop 2.2.0 support. (jinho via hyunsik)--Closes #215;5c82b7db42c718652d2a1fbb7bdd29d852e9565d
TAJO-1153: Merge off-heap package in block_iteration branch to master branch.--Closes #225;514ed8474a843c92b2fb772971e41f53010f5a4e
TAJO-1032: Improve TravisCI scripts to adjust log4j log level. (jinho)--Closes #226;080f4e1454fb8dfabe1c15e58d3c1eff8ecd6f6d
TAJO-1150: Some weird methods in QueryClientImpl should be fixed. (Jongyoung Park via hyunsik)--Closes #223;a23443570b92333e5d0e337576db68a842caef5f
Fixed missed classpath change of TAJO-1141.;aa5e3b683120a8b1841c523232b7a8a28371e7c9
TAJO-1141: Refactor the packages hierarchy of tajo-client.--Closes #217;c59baa3ad60e92da2ebd1fb636f301e5ca4f585d
TAJO-1139: ExternalSortExec should delete the intermediate files. (jinho via hyunsik)--Closes #212;154da1e492e9e1ad4e752dbf396f9d4f1973ec21
TAJO-1133: Add 'bin/tajo version' command. (Jihun Kang via hyunsik)--Closes #219;0319b1f0a71a65821408623f28f39ea4ec419bc9
TAJO-1145: Add 'bin/tajo --help' command. (Jihun Kang via hyunsik)--Closes #220;4b0f6befd45348b5b532cfa811c050b9efd9f473
TAJO-1114: Improve ConfVars (SessionVar) to take a validator interface to check its input. (Jihun Kang via hyunsik)--Closes #218;f728413fe36918a9b5e2381af951c05361900099
TAJO-1140: Separate TajoClient into fine grained parts.--Closes #213;f80beaf64d33850ee79e8ae32b33a852f56712f0
Revert "TAJO-1114: Improve ConfVars (SessionVar) to take a validator interface to check its input. (Jihun Kang via hyunsik)"--This reverts commit ee89c65b44142ca640020339e7ab5a608c1a8bf9.;8741e68291cb8dccb64d4c2e0b872cc56a4dbf3f
Revert "TAJO-1114: Improve ConfVars (SessionVar) to take a validator interface to check its input. (fixed compilation error)"--This reverts commit 7a65763554e556498b6d52dd2685636c3b6584b3.;58b8eb45c0ef39047fb1738c10e2411a8cc0dc5e
Revert "Fixed a missed compilation error in TestValidators."--This reverts commit b3749a0931e4e2c5447d9ce4cdfe43245300ef61.;1d63dca5e7724ff680c553b8616af6b0b001acf4
Fixed a missed compilation error in TestValidators.;b3749a0931e4e2c5447d9ce4cdfe43245300ef61
TAJO-1114: Improve ConfVars (SessionVar) to take a validator interface to check its input. (fixed compilation error);7a65763554e556498b6d52dd2685636c3b6584b3
TAJO-1114: Improve ConfVars (SessionVar) to take a validator interface to check its input. (Jihun Kang via hyunsik)--Closes #214;ee89c65b44142ca640020339e7ab5a608c1a8bf9
TAJO-1132: More detailed version info in tsql.--Closes #211;b5f3a7481eb7af0c4004a27f0d16bf203a8c4620
TAJO-1126: Join condition including functions throws IllegalArgumentException.--Closes #209;d9ba02bc1adebf12660d0af192d3d3c5441e7cd1
TAJO-1125: Separate logical plan and optimizer into a maven module. (missed jar copy);3c3bcce8e3ddac4480499be3edae69bb0d2554a3
TAJO-1125: Separate logical plan and optimizer into a maven module.--Closes #210;b143f991242b79fa8479148cd79fad7d4f8f2146
TAJO-1121: Remove the 'v2' storage package.--Closes #203;b636e8b8be623a87d291d7be7aa1dd645502469f
Update Tajo site for 0.9.0 release.;0fb2285fb4ad054db16a18a75d2bbc2bf5317ce5
TAJO-235: Support Oracle CatalogStore. (Jihun Kang via hyunsik)--Closes #154;0563a6a26fd97a3e8cfa9c6ae99772436c58da76
TAJO-233: Support PostgreSQL CatalogStore. (Jihun Kang via hyunsik);2e32f5a6271d6952f77839ff639e11537af03ebf
TAJO-1092: Improve the function system to allow other function implementation types.--Closes #178;d56737b999ebb5ad822d32b336752f98cffb78f8
Change the pom version of tajo-hcatalog to 0.9.1-SNAPSHOT.;8bc4582f17c1d987a8f8e13a5f90f8e69bb09e5c
[maven-release-plugin] prepare for next development iteration;f531495c24e0f1899d7822bc6b463148d27d0068
[maven-release-plugin] prepare release release-0.9.0-rc0;1e03c88e4f837e400b53e91a3338f559d2657a31
TAJO-1113: SubQuery in KILLED state should handle unexpected events.--Closes #199;3d334f3f45443b4d39a4d029de2482e5629a6e10
TAJO-1111: TestKillQuery.testKillQueryFromInitState occasionally fails.--Closes #198;22c43c0aded9b4689f863b38550c52d5ee5135c5
Update Apache POM to 15.;0646eda5198680c17e66fc6e96eeeb283ffe342d
TAJO-1110: JAVA_PULLSERVER_HEAP_MAX in bin/tajo should be increased.--Closes #197;27079643b5b62fc1f6196f3b6c2a794256097663
TAJO-1107: Broadcast join on non-leaf node scans only first data file.--Closes #193;5f64cbb1a64e2bcc034fb3f82c65ae448cb824bd
TAJO-1105: Add thread which detects JVM pauses like HADOOP's. (jinho)--Closes #191;140083bfbaf6dafb330eebbc1c7f7447c5292c1e
TAJO-1069: TAJO-1069: Add document to explain High Availability support. (jaehwa)--Closes #180;55d68ece60c5d05cabe1bce244e681f9347083e3
TAJO-1093: DateTimeFormat.to_char() is slower than SimpleDateFormat.format(). (bug fix)--Closes #194;bbd7a768a161be0e529ef41dea325fae196a4c1d
TAJO-1106: Missing session check in getFinishedQuery API. (Yongjun Park via hyunsik)--Closes #190;0adc754d9c020abb4811eb4c0f70022460be7a79
TAJO-1021: Remove the member variable Builder from all classes inherited from ProtoObject.--Closes #188;d94727f893bcac2866da4232ee71fe1b435d4759
TAJO-1104: Using asterisk with GROUP BY causes NPE.--Closes #187;8967d113571fe72131433e39753e41c35abe2297
TAJO-1099: LogicalPlanner::convertDataType causes NPE in some cases.--Closes #185;561edf3cb5328a5582d743e96ab596da347c1b90
TAJO-1102: Self-join with a partitioned table returns wrong result data.--Closes #189;f42baa005dbf3f4fe64e3f3745616164df9aba65
TAJO-1097: IllegalArgumentException: RawFileScanner. (Mai Hai Thanh via jinho)--Closes #183;0b2ea889b06166539aabdc0fdd9029008e5f1f7a
TAJO-1010: Improve multiple DISTINCT aggregation. (Hyoungjun Kim and jaehwa)--Closes #136;0dfa3972c6a52d785b8e55f91d0906456a3926b3
TAJO-1103: Insert clause of partitioned table loses some FetchImpls. (jinho)--Closes #186;de28c82942ae0fd2d06b45bcf629d660c30a9888
TAJO-1101: Broadcast join with a zero-length file table returns wrong result data.--Closes #184;2eba8aa30e1266e15ad918e4b150259bff6b31df
TAJO-1093: DateTimeFormat.to_char() is slower than SimpleDateFormat.format(). (Jihun Kang via hyunsik)--Closes #177;d0f9ebc1c501721ecee5422534b1740e38105996
TAJO-1096: Update download source documentation (Mai Hai Thanh via jaehwa)--Closes #182;44e6fe595da28c6c06e5c82741478a8ff3031fa9
TAJO-1067: INSERT OVERWRITE INTO should not remove all partitions. (jaehwa);ca5fb301bff4b38d80a523d5bece9eaf74f64ec3
Updated Change Note.;ca187bcf68ce81b984ccb7c2e2b5adc25ebff237
Merge branch 'master' of https://git-wip-us.apache.org/repos/asf/tajo into TAJO-1062;03847cf497779d18d323bf94a9e2f0d79dadcb96
Rename cli.rst to tsql.rst;28b4cbc036b05a109694e1dcbaeacd802d0c9f71
TAJO-668: Add datetime function documentation. (Jongyoung Park via hyunsik)--Closes #160;ecc2b05af60d9540c758839c1f5d691850ac772b
TAJO-1030: Not supported JDBC APIs should return empty results instead of Exception. (Hyoungjun Kim via hyunsik)--Closes #145;029054b45c158159325a68ac1491256e3abe71f4
TAJO-1065: The \admin -cluster argument doesn't run as expected. (Jongyoung Park via hyunsik)--Closes #173;68b44da57e53f53e88bedc0bb7ac763c97f069a9
TAJO-1072: CLI gets stuck when wrong host/port is provided. (Jihun Kang via hyunsik)--Closes #169;4e203f03fb533e04577f5c2947823fedd8680b8a
TAJO-1081: Non-forwarded (simple) query shows wrong rows. (missed fix for test);a90438f9846519b63a80376ec09b760a22bbc951
TAJO-1081: Non-forwarded (simple) query shows wrong rows.--Closes #175;3d029fa90e483e6d0678b8b6c72c4a2410e97399
TAJO-1077: Add Derby configuration documentation.--Closes #163;d1022fbb8fb182ef1f83997c255f32c5f40f37d0
TAJO-1068: Add SQL Query documentation.--Closes #155;2d4b0847ff13dced41d47fd740b6c699bba0c945
TAJO-981: Help command (\?) in tsql takes too long time. (YeonSu Han via jaehwa)--Closes #174;0356a5257cd2426d783642e27478eaae95ddfe7d
Update some comments.;b6c06138e756823daebf188174e63bead43c0c05
TAJO-962: Column reference used in LIMIT clause incurs NPE.--Closes #164;bccac701d5c3467ec7d7b39a1f1dd10b73cadf76
Use "Tajo" instead of "tajo";e1f2b6b437fdb842166f8cf7a8c8fbf4bce19041
Rename back_command.rst;327a9c4edd5426521b86afac12dbab4640a7164a
TAJO-1074: Query calculates wrong progress before subquery init. (jinho)--Closes #162;35e49f039ccabf46d8cf20511c189aea7c15571a
TAJO-1078: Update contributor list.--Closes #165;f295ddc39adc50fc61f48b5885b5845d0851501d
Update some typos;706be644389f1223f5ea19d1418c6b6aa8b9bc96
Merge branch 'master' of https://git-wip-us.apache.org/repos/asf/tajo into TAJO-1062;a5402249a2f7df85aa01280ed359f1d1d3489281
Update tsql documentation.;e59fe460cc888bfebe968619405edd9b9e57e410
TAJO-1061: Update build documentation. (jaehwa)--Closes #157;52e554390fa2b953304ee38006d74beac488f5c0
TAJO-1060: Apply updated hadoop versions to README and BUILDING files. (jinho)--Closes #158;d384cf00d2288910b431cf61b1b74ccc9359ae24
TAJO-1070: BSTIndexScanExec should not seek a negative offset. (jinho)--Closes #159;55bfa680bfac102e90a73c3f9c7436fabf85688e
TAJO-983: Worker should directly read Intermediate data stored in localhost rather than fetching. (Mai Hai Thanh via hyunsik);644b7cd991ea402115c6dc1d198e7f1d7f41771b
TAJO-1025: Network disconnection during query processing can cause infinite exceptions. (Jihun Kang via jinho);9e026a9a26a1004d4742f0e44d5b5d71691195ad
TAJO-1062: Update TSQL documentation;0e63abc71723c4c22f2c591ae60d892a9707973f
Merge branch 'master' of https://git-wip-us.apache.org/repos/asf/tajo;52a942136c549f197d6d1c3d1a13717e6f14a83f
TAJO-667: Add math function documentation. (Jongyoung Park via hyunsik)--Closes #153;5a7e27254b913b81c8199eff0ae3855375a07559
TAJO-910: Simple query (non-forwarded query) should be supported against partition tables.--Closes #138;7510f886e7f310dede3f9460ca40ad4bdd46e4cf
TAJO-1035: Add default TAJO_PULLSERVER_HEAPSIZE--Closes #148;cda6c897ab207ba73afa9d0dae7cecec9ba374aa
TAJO-1049: Remove the parallel degree limit up to the maximum cluster capacity.--Closes #147;e5f7c9591c71c998e702c789d249af20da3eeb6b
TAJO-1047: DefaultTaskScheduler:allocateRackTask is failed occasionally on JDK 1.7. (jinho)--Closes #144;1b3d51e149039db86d8c65f1fe3f0c8953b6faf4
TAJO-1056: Wrong resource release or wrong task scheduling. (jinho)--Closes #151;621d9145ff5f2d2551ebd3fce11a87f23413201e
TAJO-1050: RPC client does not retry during connecting. (Jihun Kang via jinho);5b31fc4207ef1de2418cafbc6d3e714fa03849d0
TAJO-1016: Refactor worker rpc information. (jinho)--Closes #125;28282b561ad0a75f9603936bf04f2aa5c99b6b58
TAJO-1046: Remove hadoop native dependency of pullserver. (jinho)--Closes #143;469820db19aedcf10ea41807e4cbc7ade48d780c
TAJO-1054: Wrong comment in ByteUtils.splitWorker(). (Jongyoung Park via jinho);1cff979c28f5922c4a69a4295f49309358bd2d81
TAJO-948: 'INSERT INTO' statement to non existence table casuses NPE. (Jongyoung Park via hyunsik)--Closes #142;200177482fbce1e33de22ad3a22f7c6b4c9cb7b7
